"id";"ssflag";"pagenumberinocrdocument";"authorfirstname";"authorlastname";"title";"firsteditionpublisher";"firsteditionpublicationplace";"firsteditionpublicationyear";"secondeditionpublisher";"secondeditionpublicationplace";"secondeditionpublicationyear";"additionalinfos";"ocrresult"
"71757";"2";"88";"Albert";"Londres";"Der Weg nach Buenos Aires";"Uhlmann";"Berlin";"1928";"";"";"";"";"Londres, Albert: Der Weg nach Buenos Aires. Berlin: Uhlmann 1928."
"71758";"1";"88";"C.A.";"Loosli";"Die schlimmen Juden";"Pestalozzi-Fellenberg-Haus";"Bern";"1927";"";"";"";"";"Loosli, C.A.: Die schlimmen Juden. Bern: Pestalozzi-Fellenberg-Haus 1927."
"71759";"2";"0";"F.";"Lopatin";"Die argentinischen Pfaffen und der österreichische Maler Hitler sind wilde Antisemiten";"";"";"";"";"";"";"";"Lopatin, F.: Die argentinischen Pfaffen und der österreichische Maler Hitler sind wilde Antisemiten, o. O. u. J."
"71760";"1";"88";"Stefan";"Lorant";"I was Hitler's prisoner";"Gollancz";"London";"1935";"";"";"";"";"Lorant, Stefan: I was Hitler's prisoner. London: Gollancz 1935."
"71761";"2";"88";"Hans";"Lorbeer";"Sämtliche Schriften";"";"";"";"";"";"";"";"Lorbeer, Hans: Sämtliche Schriften."
"71762";"2";"88";"Jakob";"Lorenz-Zaleski";"Kupa zabytych [Insel der Vergessenen]";"Koło Serbskich spisowaćelow";"Bautzen";"1931";"";"";"";"";"Lorenz-Zaleski, Jakob: Kupa zabytych [Insel der Vergessenen]. Bautzen: Koło Serbskich spisowaćelow 1931."
"71763";"2";"88";"Jakob";"Lorenz-Zaleski";"Serbscy rjekowje [Wendische Helden]. Prag u";"Koło Serbskich spisowaćelow";"Bautzen";"1922";"";"";"";"";"Lorenz-Zaleski, Jakob: Serbscy rjekowje [Wendische Helden]. Prag u. Bautzen: Koło Serbskich spisowaćelow 1922."
"71764";"2";"88";"Johannes";"Lortzing";"Um die Glaubenseinheit";"Styria-Verl.";"Graz";"1935";"";"";"";"";"Lortzing, Johannes: Um die Glaubenseinheit. Graz: Styria-Verl. 1935."
"71765";"2";"88";"";"Losa";"Sexuelle Verirrungen";"Auffenberg";"Berlin";"1932";"";"";"";"";"Losa: Sexuelle Verirrungen. Berlin: Auffenberg 1932."
"71766";"2";"88";"Alexander";"Losowsky";"Sämtliche Schriften";"";"";"";"";"";"";"";"Losowsky, Alexander: Sämtliche Schriften."
"71767";"2";"88";"Ernst";"Lothar";"Sämtliche Schriften";"";"";"";"";"";"";"";"Lothar, Ernst: Sämtliche Schriften."
"71768";"2";"88";"Rudolf";"Lothar";"Erotische Komödien";"Feuer-Verl.";"Leipzig";"1924";"";"";"";"";"Lothar, Rudolf: Erotische Komödien. Leipzig: Feuer-Verl. 1924."
"71769";"2";"88";"Rudolf";"Lothar";"Die Kunst des Verführens";"Rhombus-Verl.";"Wien";"1925";"";"";"";"";"Lothar, Rudolf: Die Kunst des Verführens. Wien: Rhombus-Verl. 1925."
"71770";"2";"88";"Heiner";"Lotze";"Organisiertes Kapital";"Urania-Verl.";"Jena";"1931";"";"";"";"";"Lotze, Heiner: Organisiertes Kapital. Jena: Urania-Verl. 1931."
"71771";"2";"88";"Pierre";"Louys";"Aphrodite";"Schmitz-Verl.";"Wien";"1927";"Schneider";"Leipzig";"1929";"";"Louys, Pierre: Aphrodite. Wien: Schmitz-Verl. 1927. — Leipzig: Schneider 1929."
"71772";"2";"88";"Pierre";"Louys";"Trois Filles de leur mère";"Officina Serpentis";"Berlin";"1929";"";"";"";"";"Louys, Pierre: Trois Filles de leur mère. Berlin: Officina Serpentis 1929."
"71773";"2";"88";"Pierre";"Louys";"Gespräche der griechischen Hetären";"Hynek";"Prag";"1900";"";"";"";"";"Louys, Pierre: Gespräche der griechischen Hetären. Prag: Hynek 1900."
"71774";"2";"88";"Pierre";"Louys";"Manuel de civilité pour les petites filles";"Officina Serpentis";"Berlin";"1928";"";"";"";"";"Louys, Pierre: Manuel de civilité pour les petites filles. Berlin: Officina Serpentis 1928."
"71775";"2";"88";"Pierre";"Louys";"Pybrac";"Officina Serpentis";"Berlin";"1930";"";"";"";"";"Louys, Pierre: Pybrac. Berlin: Officina Serpentis 1930."
"71776";"2";"88";"Alfred";"Lowitsch";"Energie, Planwirtschaft u. Sozialismus";"Urania-Verl.";"Jena";"1929";"";"";"";"";"Lowitsch, Alfred: Energie, Planwirtschaft u. Sozialismus. Jena: Urania-Verl. 1929."
"71777";"2";"88";"Alexander";"Lubin";"Hilfe für Mutter und Kind in der Sowjetunion und in Deutschland";"Verl. f. Sexualpolitik";"Berlin";"1932";"";"";"";"";"Lubin, Alexander: Hilfe für Mutter und Kind in der Sowjetunion und in Deutschland. Berlin: Verl. f. Sexualpolitik 1932."
"71778";"1";"88";"Kurt G. W.";"Ludecke";"I knew Hitler";"Jarrolds";"London";"1938";"Ch. Scribner";"New York";"1938";"";"Ludecke, Kurt G. W.: I knew Hitler. London: Jarrolds 1938. — New York: Ch. Scribner 1938."
"71779";"2";"88";"Erich";"Ludendorff";"Gefesselte Arbeitskraft";"Ludendorff-Verl.";"München";"1931";"";"";"";"";"Ludendorff, Erich: Gefesselte Arbeitskraft. München: Ludendorff-Verl. 1931."
"71780";"2";"88";"Erich";"Ludendorff";"Der Bauer stirbt — mit ihm das Volk!";"Ludendorff-Verl.";"München";"1933";"";"";"";"";"Ludendorff, Erich: Der Bauer stirbt — mit ihm das Volk! München: Ludendorff-Verl. 1933."
"71781";"2";"88";"Erich";"Ludendorff";"Heraus aus dem braunen Sumpf";"Ludendorff-Verl.";"München";"1932";"";"";"";"";"Ludendorff, Erich: Heraus aus dem braunen Sumpf. München: Ludendorff-Verl. 1932."
"71782";"2";"88";"Erich";"Ludendorff";"An meine Mitkämpfer!";"Selbstverl.";"Tutzing";"1933";"";"";"";"";"Ludendorff, Erich: An meine Mitkämpfer! Tutzing: Selbstverl. 1933."
"71783";"2";"88";"Erich";"Ludendorff";"Ein Trauerspiel in 3 Aufzügen und einem Zwischenspiel";"Selbstverl.";"Tutzing";"1935";"";"";"";"";"Ludendorff, Erich: Ein Trauerspiel in 3 Aufzügen und einem Zwischenspiel. Tutzing: Selbstverl. 1935."
"71784";"2";"88";"Erich";"Ludendorff";"Hitlers Verrat der Deutschen an den römischen Papst";"Ludendorff-Verl.";"München";"1931";"";"";"";"";"Ludendorff, Erich: Hitlers Verrat der Deutschen an den römischen Papst. München: Ludendorff-Verl. 1931."
"71785";"2";"90";"Raymonde";"Machard";"Triumph des Eros";"Drei-Masken-Verl.";"München";"1929";"";"";"";"";"Machard, Raymonde: Triumph des Eros. München: Drei-Masken-Verl. 1929."
"71786";"1";"90";"Boris";"Machlin";"Um das Zwei- und Dreifache";"Verlagsgen. ausländ. Arbeiter";"Moskau";"1932";"";"";"";"";"Machlin, Boris: Um das Zwei- und Dreifache. Moskau: Verlagsgen. ausländ. Arbeiter 1932."
"71787";"2";"90";"John Henry";"Mackay";"Die Bücher der namenlosen Liebe";"";"";"";"";"";"";"Sämtliche Ausgaben";"Mackay, John Henry: Die Bücher der namenlosen Liebe. Sämtliche Ausgaben."
"71788";"2";"0";"John Henry";"Mackay";"Der Puppenjunge";"Stegemann";"Berlin";"1926";"";"";"";"";"Mackay, John Henry: Der Puppenjunge, o. O. 1926. — Berlin: Stegemann 1926."
"71789";"1";"90";"Mary";"Macmillan";"Sally Bleistift in Amerika";"Verlagsgen. ausländ. Arbeiter";"Moskau";"1935";"";"";"";"";"Macmillan, Mary: Sally Bleistift in Amerika. Moskau: Verlagsgen. ausländ. Arbeiter 1935."
"71790";"2";"0";"Marie";"Madeleine";"s. Marie Madeleine";"";"";"";"";"";"";"";"Madeleine, Marie s. Marie Madeleine."
"71791";"1";"90";"Robert";"Maeder";"Ich bin katholisch";"Verl. Nazareth";"Basel";"1928";"";"";"";"";"Maeder, Robert: Ich bin katholisch. Basel: Verl. Nazareth 1928."
"71792";"1";"90";"Robert";"Maeder";"Maria siegt";"Verl. Nazareth";"Basel";"1935";"";"";"";"";"Maeder, Robert: Maria siegt. Basel: Verl. Nazareth 1935."
"71793";"2";"90";"";"";"Maerchen, Das ~ vom Preisabbau";"Allg. Dt. Gewerkschaftsbund";"Berlin";"1925";"";"";"";"";"Maerchen, Das ~ vom Preisabbau. Berlin: Allg. Dt. Gewerkschaftsbund 1925."
"71794";"2";"90";"Maurice";"Magre";"Das Laster von Granada";"Musarion";"München";"1928";"Hagenberg";"Wien";"1933";"";"Magre, Maurice: Das Laster von Granada. München: Musarion 1928. — Wien: Hagenberg 1933."
"71795";"1";"90";"Elsa";"Mahler";"Michail Nesterow";"Vita Nova-Verl.";"Luzern";"1938";"";"";"";"";"Mahler, Elsa: Michail Nesterow. Luzern: Vita Nova-Verl. 1938."
"71796";"2";"90";"Artur";"Mahraun";"Der heilige Eifer";"Nachbarschafts-Verl.";"Berlin";"1935";"";"";"";"";"Mahraun, Artur: Der heilige Eifer. Berlin: Nachbarschafts-Verl. 1935."
"71797";"2";"90";"Artur";"Mahraun";"Das jungdeutsche Manifest";"Jungdt. Verl.";"Berlin";"1928";"";"";"";"";"Mahraun, Artur: Das jungdeutsche Manifest. Berlin: Jungdt. Verl. 1928."
"71798";"2";"90";"Artur";"Mahraun";"Der grosse Plan";"Jungdt. Verl.";"Berlin";"1932";"";"";"";"";"Mahraun, Artur: Der grosse Plan. Berlin: Jungdt. Verl. 1932."
"71799";"2";"90";"Artur";"Mahraun";"Nationale Revolution und die Jungdeutschen";"Jungdt. Verl.";"Berlin";"1933";"";"";"";"";"Mahraun, Artur: Nationale Revolution und die Jungdeutschen. Berlin: Jungdt. Verl. 1933."
"71800";"2";"90";"Wladimir";"Majakowsky";"Sämtliche Schriften";"";"";"";"";"";"";"";"Majakowsky, Wladimir: Sämtliche Schriften."
"71801";"2";"90";"Curzio";"Malaparte";"Der Staatsstreich";"Tal";"Leipzig";"1932";"";"";"";"";"Malaparte, Curzio: Der Staatsstreich. Leipzig: Tal 1932."
"71802";"2";"90";"Paul";"Malek";"Nuckel als Familienvater";"Richter";"Leipzig";"1926";"";"";"";"";"Malek, Paul: Nuckel als Familienvater. Leipzig: Richter 1926."
"71803";"1";"90";"A.";"Malenki";"Magnitogorsk";"Verlagsgen. ausländ. Arbeiter";"Moskau";"1932";"";"";"";"";"Malenki, A.: Magnitogorsk. Moskau: Verlagsgen. ausländ. Arbeiter 1932."
"71804";"2";"90";"Bronislav";"Malinowski";"Mutterrechtliche Familie und Ödipus-Komplex";"Internat. Psychoanalyt. Verl.";"Wien";"1924";"";"";"";"";"Malinowski, Bronislav: Mutterrechtliche Familie und Ödipus-Komplex. Wien: Internat. Psychoanalyt. Verl. 1924."
"71805";"2";"90";"Bronislav";"Malinowski";"Das Geschlechtsleben der Wilden";"Grethlein";"Leipzig";"1930";"";"";"";"";"Malinowski, Bronislav: Das Geschlechtsleben der Wilden. Leipzig: Grethlein 1930."
"71806";"1";"90";"Stefan";"Malinowski";"Co kazdy Polak o Hitleryzmie wiedziec powinien [Was jeder Pole vom Hitlerismus wissen muss]";"Hoesick";"Warschau";"1938";"";"";"";"";"Malinowski, Stefan: Co kazdy Polak o Hitleryzmie wiedziec powinien [Was jeder Pole vom Hitlerismus wissen muss]. Warschau: Hoesick 1938."
"71807";"2";"90";"Pierre J. Felicien";"Mallefille";"Don Juan. Sämtliche Ausgaben";"";"";"";"";"";"";"";"Mallefille, Pierre J. Felicien: Don Juan. Sämtliche Ausgaben."
"71808";"1";"90";"Bertil";"Malmberg";"Tyska Intryck 1936";"Bonnier";"Stockholm";"1936";"";"";"";"";"Malmberg, Bertil: Tyska Intryck 1936. Stockholm: Bonnier 1936."
"71809";"1";"90";"André";"Malraux";"So lebt der Mensch";"Europa-Verl.";"Zürich";"1934";"";"";"";"";"Malraux, André: So lebt der Mensch. Zürich: Europa-Verl. 1934."
"71810";"1";"90";"André";"Malraux";"Le temps du mépris";"Nouv. Revue française";"Paris";"1935";"";"";"";"";"Malraux, André: Le temps du mépris. Paris: Nouv. Revue française 1935."
"71811";"1";"0";"Malraux";"André";"Die Zeit der Verachtung. — Sämtliche Ausgaben";"";"";"";"";"";"";"";"Malraux, André: Die Zeit der Verachtung. — Sämtliche Ausgaben."
"71812";"2";"90";"Josef";"Maneles";"Der deutsch-jüdische Krieg";"Selbstverl.";"Wien";"1935";"";"";"";"";"Maneles, Josef: Der deutsch-jüdische Krieg. Wien: Selbstverl. 1935."
"71813";"2";"90";"Georg";"Manes";"Die sexuelle Not unserer Jugend";"Oldenburg";"Leipzig";"1923";"";"";"";"";"Manes, Georg: Die sexuelle Not unserer Jugend. Leipzig: Oldenburg 1923."
"71814";"2";"90";"";"";"Mann der Arbeit her zu uns";"Vorwärts";"Berlin";"1912";"";"";"";"";"Mann der Arbeit her zu uns! Berlin: Vorwärts 1912."
"71815";"2";"90";"Erika";"Mann";"Sämtliche Schriften";"";"";"";"";"";"";"";"Mann, Erika: Sämtliche Schriften."
"71816";"2";"92";"Valeriu";"Marcu";"Sämtliche Schriften";"";"";"";"";"";"";"";"Marcu, Valeriu: Sämtliche Schriften."
"71817";"2";"92";"Ernst";"Marcus";"Das Erkenntnisproblem";"Der Sturm";"Berlin";"1919";"";"";"";"";"Marcus, Ernst: Das Erkenntnisproblem. Berlin: Der Sturm 1919."
"71818";"2";"92";"Julian";"Marcuse";"Die Beschränkung der Geburtenzahl";"Reinhardt";"München";"1913";"";"";"";"";"Marcuse, Julian: Die Beschränkung der Geburtenzahl. München: Reinhardt 1913."
"71819";"2";"92";"Julian";"Marcuse";"Geschlechtliche Erziehung in der Arbeiterfamilie";"Vorwärts";"Berlin";"1911";"";"";"";"";"Marcuse, Julian: Geschlechtliche Erziehung in der Arbeiterfamilie. Berlin: Vorwärts 1911."
"71820";"2";"92";"Julian";"Marcuse";"Die Fruchtabtreibung in Gesetzgebung und ärztlichem Handeln";"Pflaum";"München";"1924";"";"";"";"";"Marcuse, Julian: Die Fruchtabtreibung in Gesetzgebung und ärztlichem Handeln. München: Pflaum 1924."
"71821";"2";"92";"Julian";"Marcuse";"Warum Geburtenregelung?";"Arbeiterwohlfahrt";"Berlin";"1930";"";"";"";"";"Marcuse, Julian: Warum Geburtenregelung? Berlin: Arbeiterwohlfahrt 1930."
"71822";"2";"92";"Ludwig";"Marcuse";"Sämtliche Schriften";"";"";"";"";"";"";"";"Marcuse, Ludwig: Sämtliche Schriften."
"71823";"2";"92";"Jolanthe";"Marès";"Sämtliche Schriften";"";"";"";"";"";"";"";"Marès, Jolanthe: Sämtliche Schriften."
"71824";"2";"92";"Vally von";"Margitfalva";"Das Kussbuch";"Deutsch-oesterr. Verl.";"Wien";"1923";"";"";"";"";"Margitfalva, Vally von: Das Kussbuch. Wien: Deutsch-oesterr. Verl. 1923."
"71825";"1";"92";"";"Margolis, P., H. Ritter u. Stella Seidler";"Unter der Peitsche";"Verlagsgen. ausländ. Arbeiter";"Moskau";"1935";"";"";"";"";"Margolis, P., H. Ritter u. Stella Seidler: Unter der Peitsche. Moskau: Verlagsgen. ausländ. Arbeiter 1935."
"71826";"2";"92";"Paul";"Margueritte";"Bohème";"Wiener Verl.";"Wien";"1905";"";"";"";"";"Margueritte, Paul: Bohème. Wien: Wiener Verl. 1905."
"71827";"2";"92";"Paul u. Viktor";"Margueritte";"Die Kommune";"Volksstimme";"Frankfurt";"1913";"";"";"";"";"Margueritte, Paul u. Viktor: Die Kommune. Frankfurt: Volksstimme 1913."
"71828";"2";"92";"Paul und Viktor";"Margueritte";"Die Stücke des Schwertes";"H. Seemann Nachf.";"Leipzig";"1903";"";"";"";"";"Margueritte, Paul und Viktor: Die Stücke des Schwertes. Leipzig: H. Seemann Nachf. 1903."
"71829";"2";"92";"Victor";"Margueritte";"Sämtliche Schriften";"";"";"";"";"";"";"";"Margueritte, Victor: Sämtliche Schriften."
"71830";"2";"92";"Jaroslav";"Maria";"Ein König";"Heinz & Co.";"Troppau";"1938";"";"";"";"";"Maria, Jaroslav: Ein König. Troppau: Heinz & Co. 1938."
"71831";"2";"92";"Franz";"Mariaux";"Der Schutthaufen";"Hanseat. Verl.Anst.";"Hamburg";"1931";"";"";"";"";"Mariaux, Franz: Der Schutthaufen. Hamburg: Hanseat. Verl.Anst. 1931."
"71832";"2";"92";"";"Marie Madeleine (Pseud.)";"Sämtliche Schriften";"";"";"";"";"";"";"Sämtliche Schriften";"Marie Madeleine (Pseud.): Sämtliche Schriften."
"71833";"1";"92";"Jacques";"Maritain";"Gesellschaftsordnung und Freiheit";"Vita Nova-Verl.";"Luzern";"1936";"";"";"";"";"Maritain, Jacques: Gesellschaftsordnung und Freiheit. Luzern: Vita Nova-Verl. 1936."
"71834";"2";"92";"Gabriel";"Markos";"Mörder-Knute über Kinder";"Mopr-Verl.";"Berlin";"1927";"";"";"";"";"Markos, Gabriel: Mörder-Knute über Kinder. Berlin: Mopr-Verl. 1927."
"71835";"2";"92";"F.";"Markosch";"Die Neger in den Vereinigten Staaten von Nordamerika";"Mopr-Verl.";"Berlin";"1930";"";"";"";"";"Markosch, F.: Die Neger in den Vereinigten Staaten von Nordamerika. Berlin: Mopr-Verl. 1930."
"71836";"2";"92";"S.";"Markovic";"Der Kommunismus in Jugoslawien";"Hoym";"Hamburg";"1922";"";"";"";"";"Markovic, S.: Der Kommunismus in Jugoslawien. Hamburg: Hoym 1922."
"71837";"2";"92";"Ludwig von";"Marnitz";"Russisches Elementarbuch";"Gerhard";"Leipzig";"1938";"";"";"";"";"Marnitz, Ludwig von: Russisches Elementarbuch. Leipzig: Gerhard 1938."
"71838";"2";"92";"Ernst";"Martens";"Unsere sexuelle Not";"Ich-Verl.";"Hamburg";"1922";"";"";"";"";"Martens, Ernst: Unsere sexuelle Not. Hamburg: Ich-Verl. 1922."
"71839";"2";"92";"Kurt";"Martens";"Der Emigrant";"Steegemann";"Hannover";"1923";"";"";"";"";"Martens, Kurt: Der Emigrant. Hannover: Steegemann 1923."
"71840";"1";"92";"Paul";"Marti";"Parteien und Richtungen im gegenwärtigen schweizer. Protestantismus";"Beer";"Zürich";"1938";"";"";"";"";"Marti, Paul: Parteien und Richtungen im gegenwärtigen schweizer. Protestantismus. Zürich: Beer 1938."
"71841";"2";"92";"Kurt";"Martin";"Sämtliche Schriften";"";"";"";"";"";"";"";"Martin, Kurt: Sämtliche Schriften."
"71842";"1";"92";"Peter";"Martin";"Là-bas dans les geôles";"Tallandier";"Paris";"1937";"";"";"";"";"Martin, Peter: Là-bas dans les geôles. Paris: Tallandier 1937."
"71843";"1";"92";"D.";"Martschenko";"An der Schwelle des zweiten Fünfjahrplanes";"Verlagsgen. ausländ. Arbeiter";"Moskau";"1932";"";"";"";"";"Martschenko, D.: An der Schwelle des zweiten Fünfjahrplanes. Moskau: Verlagsgen. ausländ. Arbeiter 1932."
"71844";"2";"92";"André";"Marty";"Sämtliche Schriften";"";"";"";"";"";"";"";"Marty, André: Sämtliche Schriften."
"71845";"1";"92";"Alexander";"Martynow";"Vom Menschewismus zum Kommunismus";"Komm. Internationale";"Moskau";"1923";"";"";"";"";"Martynow, Alexander: Vom Menschewismus zum Kommunismus. Moskau: Komm. Internationale 1923."
"71846";"2";"94";"Frieda";"Mehler";"Vom Wege. Gedichte";"Levy";"Berlin";"1934";"";"";"";"";"Mehler, Frieda: Vom Wege. Gedichte. Berlin: Levy 1934."
"71847";"2";"94";"Klaus";"Mehnert";"Ein deutscher Austauschstudent in Kalifornien";"Dt, Verlagsanst.";"Stuttgart";"1930";"";"";"";"";"Mehnert, Klaus: Ein deutscher Austauschstudent in Kalifornien. Stuttgart: Dt, Verlagsanst. 1930."
"71848";"2";"94";"Klaus";"Mehnert";"Die Jugend in Sowjetrussland";"S. Fischer";"Berlin";"1932";"";"";"";"";"Mehnert, Klaus: Die Jugend in Sowjetrussland. Berlin: S. Fischer 1932."
"71849";"2";"94";"Franz";"Mehring";"Sämtliche Schriften";"";"";"";"";"";"";"";"Mehring, Franz: Sämtliche Schriften."
"71850";"2";"94";"Walter";"Mehring";"Sämtliche Schriften";"";"";"";"";"";"";"";"Mehring, Walter: Sämtliche Schriften."
"71851";"2";"94";"Friedrich";"Mehringer";"Das deutsche Jahr";"Höfling";"München";"1936";"";"";"";"";"Mehringer, Friedrich: Das deutsche Jahr. München: Höfling 1936."
"71852";"2";"94";"Hans";"Meiser";"Wir aber sind nicht von denen, die da weichen!";"Kaiser-Verl.";"München";"1934";"";"";"";"";"Meiser, Hans: Wir aber sind nicht von denen, die da weichen! München: Kaiser-Verl. 1934."
"71853";"2";"94";"Helmut";"Meisner";"Pfadfinder zum Volk";"Herder";"Freiburg";"1934";"";"";"";"";"Meisner, Helmut: Pfadfinder zum Volk. Freiburg: Herder 1934."
"71854";"2";"94";"";"";"Meisterin der Liebe";"Steinmann";"Wien";"1920";"";"";"";"";"Meisterin der Liebe. Wien: Steinmann 1920."
"71855";"1";"94";"Wanda";"Melcer";"Swastyka i dziecko [Das Hakenkreuz u. das Kind]";"Tow. Wyd. Roj";"Warschau";"1934";"";"";"";"";"Melcer, Wanda: Swastyka i dziecko [Das Hakenkreuz u. das Kind]. Warschau: Tow. Wyd. Roj 1934."
"71856";"1";"94";"Willy";"Melchert";"My escape from Germany";"Hutchinson & Co.";"London";"1937";"";"";"";"";"Melchert, Willy: My escape from Germany. London: Hutchinson & Co. 1937."
"71857";"2";"94";"Rose";"Meller";"Frau auf der Flucht";"Universitas";"Berlin";"1931";"";"";"";"";"Meller, Rose: Frau auf der Flucht. Berlin: Universitas 1931."
"71858";"2";"94";"Uto";"Melzer";"Mehr Bibelkenntnis!";"Ludendorff-Verl.";"München";"1932";"";"";"";"";"Melzer, Uto: Mehr Bibelkenntnis! München: Ludendorff-Verl. 1932."
"71859";"2";"94";"";"";"Memoiren, Aus den ~ eines Flagellanten oder vom Flagellanten zum Masochisten";"Welkhammer";"Wien";"1928";"";"";"";"";"Memoiren, Aus den ~ eines Flagellanten oder vom Flagellanten zum Masochisten. Wien: Welkhammer 1928."
"71860";"2";"94";"";"";"Memoiren, Aus den ~ eines Frauenarztes.";"";"Wien";"1920";"";"";"";"";"Memoiren, Aus den ~ eines Frauenarztes. Wien 1920."
"71861";"2";"94";"";"";"Memoiren, Die ~ des Stabschef Röhm";"Uranus-Verl.";"Saarbrücken";"1934";"";"";"";"";"Memoiren, Die ~ des Stabschef Röhm. Saarbrücken: Uranus-Verl. 1934."
"71862";"2";"94";"Hans";"Mend";"Adolf Hitler im Felde";"Huber";"Diessen";"1931";"";"";"";"";"Mend, Hans: Adolf Hitler im Felde. Diessen: Huber 1931."
"71863";"2";"94";"Anja";"Mendelssohn";"Verborgene Seelenkräfte";"Fändrich";"Leipzig";"1922";"";"";"";"";"Mendelssohn, Anja: Verborgene Seelenkräfte. Leipzig: Fändrich 1922."
"71864";"1";"94";"Peter";"Mendelssohn";"Das Haus Cosinsky";"Oprecht & Helbling";"Zürich";"1934";"";"";"";"";"Mendelssohn, Peter: Das Haus Cosinsky. Zürich: Oprecht & Helbling 1934."
"71865";"2";"94";"Bernhard";"Menne";"Sämtliche Schriften";"";"";"";"";"";"";"";"Menne, Bernhard: Sämtliche Schriften."
"71866";"1";"94";"Carl A.";"Mennicke";"Der Mensch im All";"A. de Lange";"Amsterdam";"1937";"";"";"";"";"Mennicke, Carl A.: Der Mensch im All. Amsterdam: A. de Lange 1937."
"71867";"2";"94";"";"";"Mensch und Gemeinschaft. Bd 1—4";"A. Hoffmann";"Berlin";"1925/26";"";"";"";"";"Mensch und Gemeinschaft. Bd 1—4. Berlin: A. Hoffmann 1925/26."
"71868";"2";"94";"";"";"Mensch, Der schöne nackte ~";"Greifenverl.";"Rudolstadt";"1928";"";"";"";"";"Mensch, Der schöne nackte ~. Rudolstadt: Greifenverl. 1928."
"71869";"1";"94";"Peter";"Merin";"Spanien zwischen Tod und Geburt";"Jean Christophe-Verl.";"Zürich";"1937";"";"";"";"";"Merin, Peter: Spanien zwischen Tod und Geburt. Zürich: Jean Christophe-Verl. 1937."
"71870";"2";"94";"Friedrich";"Merkenschlager";"Zwischen Hünengrab und Pfahlbau";"Hoffmann";"Berlin";"1934";"";"";"";"";"Merkenschlager, Friedrich: Zwischen Hünengrab und Pfahlbau. Berlin: Hoffmann 1934."
"71871";"2";"94";"Friedrich";"Merkenschlager";"Rassensonderung, Rassenmischung, Rassenwandlung";"Hoffmann";"Berlin";"1933";"";"";"";"";"Merkenschlager, Friedrich: Rassensonderung, Rassenmischung, Rassenwandlung. Berlin: Hoffmann 1933."
"71872";"2";"94";"";"Merkenschlager, Friedrich, u. Karl Saller";"Ofnet";"K. Wolff";"Berlin";"1934";"";"";"";"";"Merkenschlager, Friedrich, u. Karl Saller: Ofnet. Berlin: K. Wolff 1934."
"71873";"2";"94";"";"Merkenschlager, Friedrich, u. Karl Saller";"Vineta";"Korn";"Breslau";"1935";"";"";"";"";"Merkenschlager, Friedrich, u. Karl Saller: Vineta. Breslau: Korn 1935."
"71874";"2";"94";"Frances u. Mason";"Merrill";"Unter Nackten";"Oldenburg";"Leipzig";"1932";"";"";"";"";"Merrill, Frances u. Mason: Unter Nackten. Leipzig: Oldenburg 1932."
"71875";"2";"94";"Violet A.";"Merris";"Eduard, Herzog von Windsor";"Höger";"Wien";"1937";"";"";"";"";"Merris, Violet A.: Eduard, Herzog von Windsor. Wien: Höger 1937."
"71876";"2";"94";"Carl";"Mertens";"Verschwörer und Fememörder";"Weltbühne";"Berlin";"1926";"";"";"";"";"Mertens, Carl: Verschwörer und Fememörder. Berlin: Weltbühne 1926."
"71877";"1";"94";"Konrad";"Merz";"Ein Mensch fällt aus Deutschland";"Querido-Verl.";"Amsterdam";"1936";"";"";"";"";"Merz, Konrad: Ein Mensch fällt aus Deutschland. Amsterdam: Querido-Verl. 1936."
"71878";"1";"96";"P.";"Mif";"Die kommunistische Partei Chinas im Kampfe um die Befreiung des chines. Volkes";"Verlagsgen. ausländ. Arbeiter";"Moskau";"1937";"";"";"";"";"Mif, P.: Die kommunistische Partei Chinas im Kampfe um die Befreiung des chines. Volkes. Moskau: Verlagsgen. ausländ. Arbeiter 1937."
"71879";"1";"96";"Madeleine";"Migeon";"Sous la terreur brune";"Moorthamers Frères";"Antwerpen";"1933";"";"";"";"";"Migeon, Madeleine: Sous la terreur brune. Antwerpen: Moorthamers Frères 1933."
"71880";"1";"96";"A. J.";"Mikojan";"Die Lebensmittelversorgung und unsere Aufgaben";"Verlagsgen. ausländ. Arbeiter";"Moskau";"1931";"";"";"";"";"Mikojan, A. J.: Die Lebensmittelversorgung und unsere Aufgaben. Moskau: Verlagsgen. ausländ. Arbeiter 1931."
"71881";"1";"96";"A. J.";"Mikojan";"Die Nahrungsmittelindustrie der Sowjetunion";"Verlagsgen. ausländ. Arbeiter";"Moskau";"1936";"";"";"";"";"Mikojan, A. J.: Die Nahrungsmittelindustrie der Sowjetunion. Moskau: Verlagsgen. ausländ. Arbeiter 1936."
"71882";"1";"96";"E. M.";"Mikulina";"Der Wettbewerb der Massen";"Verlagsgen. ausländ. Arbeiter";"Moskau";"1932";"";"";"";"";"Mikulina, E. M.: Der Wettbewerb der Massen. Moskau: Verlagsgen. ausländ. Arbeiter 1932."
"71883";"2";"96";"George";"Milburne";"Die Stadt Oklahoma";"Rowohlt";"Berlin";"1932";"";"";"";"";"Milburne, George: Die Stadt Oklahoma. Berlin: Rowohlt 1932."
"71884";"2";"96";"Hedwig S.";"Milde";"Liebe der Armen";"Tal";"Leipzig";"1931";"";"";"";"";"Milde, Hedwig S.: Liebe der Armen. Leipzig: Tal 1931."
"71885";"2";"96";"Hedwig S.";"Milde";"Die Liebe der Zehnjährigen";"Speidel";"Wien";"1930";"";"";"";"";"Milde, Hedwig S.: Die Liebe der Zehnjährigen. Wien: Speidel 1930."
"71886";"2";"96";"";"Miles";"Der schwarze Spion";"Heimat-Verl.";"Brixlegg";"1937";"";"";"";"";"Miles: Der schwarze Spion. Brixlegg: Heimat-Verl. 1937."
"71887";"1";"96";"";"Miles Ecclesiae (Pseud.)";"Hitler gegen Christus";"Société d'éditions européennes";"Paris";"1936";"";"";"";"";"Miles Ecclesiae (Pseud.): Hitler gegen Christus. Paris: Société d'éditions européennes 1936."
"71888";"2";"96";"Wladimir Paul";"Miljutin";"Die Organisation der Volkswirtschaft in Sowjetrussland";"";"";"";"";"";"";"Sämtl. Ausgaben";"Miljutin, Wladimir Paul: Die Organisation der Volkswirtschaft in Sowjetrussland. Sämtl. Ausgaben."
"71889";"2";"96";"Anton van";"Miller";"Deutsche und Juden";"Soziolog. Verl.Anst.";"M.-Ostrau";"1936";"";"";"";"";"Miller, Anton van: Deutsche und Juden. M.-Ostrau: Soziolog. Verl.Anst. 1936."
"71890";"2";"96";"Friedrich M.";"Minck";"Rätesozialismus";"Rätebund";"Berlin";"1920";"";"";"";"";"Minck, Friedrich M.: Rätesozialismus. Berlin: Rätebund 1920."
"71891";"1";"96";"Th.";"Mindt";"Und morgen wieder Krise?";"Malik-Verl.";"London";"1938";"";"";"";"";"Mindt, Th.: Und morgen wieder Krise? London: Malik-Verl. 1938."
"71892";"1";"0";"Wang";"Ming";"Die revolutionäre Bewegung in den kolonialen u. halbkolonialen Ländern";"Verlagsgen. ausländ. Arbeiter";"Moskau";"1935";"";"";"";"";"+ Ming, Wang: Die revolutionäre Bewegung in den kolonialen u. halbkolonialen Ländern ... Moskau: Verlagsgen. ausländ. Arbeiter 1935."
"71893";"1";"96";"Wang";"Ming";"Das revolutionäre China von heute";"Verlagsgen. ausländ. Arbeiter";"Moskau";"1934";"";"";"";"";"Ming, Wang: Das revolutionäre China von heute. Moskau: Verlagsgen. ausländ. Arbeiter 1934."
