"id";"ssflag";"pagenumberinocrdocument";"authorfirstname";"authorlastname";"title";"firsteditionpublisher";"firsteditionpublicationplace";"firsteditionpublicationyear";"secondeditionpublisher";"secondeditionpublicationplace";"secondeditionpublicationyear";"additionalinfos";"ocrresult"
"72970";"2";"5";"";"";"Aufbauwerk, Zwei Jahre ~ der Regierung Dollfuss";"Österr. Bundespressedienst";"Wien";"1934";"";"";"";"";"Aufbauwerk, Zwei Jahre ~ der Regierung Dollfuss. Wien: Österr. Bundespressedienst 1934."
"72971";"2";"5";"Siegfried";"Aufhaeuser";"Sämtliche Schriften";"";"";"";"";"";"";"";"Aufhaeuser, Siegfried: Sämtliche Schriften."
"72972";"2";"5";"";"";"Aufklaerungswerk, Das grosse~für Braut- u. Eheleute";"Gutenberg";"Dresden";"1933";"";"";"";"";"Aufklaerungswerk, Das grosse~für Braut- u. Eheleute. Dresden: Gutenberg 1933."
"72973";"2";"5";"";"";"Aufrichtung, Die ~ des Reiches der Gerechtigkeit";"Bibel- u. Traktat-Ges.";"Frankfurt a.M.";"1920";"";"";"";"";"Aufrichtung, Die ~ des Reiches der Gerechtigkeit. Frankfurt a/M.: Bibel- u. Traktat-Ges. 1920."
"72974";"1";"0";"";"";"Auftrag an die Deputierten des 14. Leningrader Sowjets";"Verlagsgen. ausländ. Arbeiter";"Moskau";"1934";"";"";"";"";"+ Auftrag an die Deputierten des 14. Leningrader Sowjets ... Moskau: Verlagsgen, ausländ. Arbeiter 1934."
"72975";"1";"5";"";"";"Au rouge vif. Anecdotes intimes sur la flagellation";"Office central de librairie";"Paris";"1911";"";"";"";"";"Au rouge vif. Anecdotes intimes sur la flagellation. Paris: Office central de librairie 1911."
"72976";"2";"5";"";"";"Ausgang, Lenchens ~ oder ein Blick durchs Schlüsselloch.";"";"o. O.";"1931";"";"";"";"";"Ausgang, Lenchens ~ oder ein Blick durchs Schlüsselloch. o. O. 1931."
"72977";"2";"0";"";"";"Aussenseiter des Sexuallebens";"Renatus-Verl.";"Berlin";"1931";"";"";"";"";"Aussenseiter des Sexuallebens. Berlin: Renatus-Verl. 1931. "
"72978";"2";"5";"";"";"Austerlitz, Friedrich.—Austerlitz spricht";"Wiener Volksbuchh.";"Wien";"1931";"";"";"";"";"Austerlitz, Friedrich.—Austerlitz spricht. Wien: Wiener Volksbuchh. 1931."
"72979";"2";"5";"";"";"Austro-Nazi ohne Maske. Ein Gang durch den braunen Lügenwald";"österr. Heimatdienst";"Wien";"1933";"";"";"";"";"Austro-Nazi ohne Maske. Ein Gang durch den braunen Lügenwald. Wien: österr. Heimatdienst 1933."
"72980";"2";"0";"";"";"Auszuege aus der Bibel.";"";"Landsberg a. W.";"Pfeiffer";"1934";"";"";"";"Auszuege aus der Bibel. Landsberg a. W.: K. Pfeiffer 1934. "
"72981";"2";"5";"";"";"Autarkie. Vorträge auf der 1. Kundgebung des Dt. Bundes für freie Wirtschaftspolitik";"Rowohlt";"Berlin";"1932";"";"";"";"";"Autarkie. Vorträge auf der 1. Kundgebung des Dt. Bundes für freie Wirtschaftspolitik. Berlin: Rowohlt 1932."
"72982";"1";"5";"Alexander";"Awdejenko";"Ich liebe";"Verlagsgen. ausländ. Arbeiter";"Moskau";"1934";"Malik-Verl.";"Prag";"1935";"";"Awdejenko, Alexander: Ich liebe. Moskau: Verlagsgen. ausländ. Arbeiter 1934. — Prag: Malik-Verl. 1935."
"72983";"1";"0";"Paul";"Axelrod";"Die Entwicklung der Sozialrevolutionären Bewegung in Rußland";"";"Zürich";"1881";"";"";"";"";"Axelrod, Paul: Die Entwicklung der Sozialrevolutionären Bewegung in Rußland. Zürich 1881."
"72984";"1";"5";"";"";"Azana, Manuel. — Azana spricht";"Ed. du Carrefour";"Paris";"1937";"";"";"";"";"Azana, Manuel. — Azana spricht. Paris: Ed. du Carrefour 1937."
"72985";"2";"7";"Heinrich";"Bannlza von Bazan";"Fackeln der jungen Front";"Wolff";"Plauen";"1932";"";"";"";"";"Bannlza von Bazan, Heinrich: Fackeln der jungen Front. Plauen: Wolff 1932."
"72986";"2";"7";"Heinrich";"Banniza von Bazan";"Jungen am Feuer";"Wolff";"Plauen";"1932";"";"";"";"";"Banniza von Bazan, Heinrich: Jungen am Feuer. Plauen: Wolff 1932."
"72987";"2";"7";"Ewald";"Banse";"Raum und Volk im Weltkriege";"Stalling";"Oldenburg";"1932";"";"";"";"";"Banse, Ewald: Raum und Volk im Weltkriege. Oldenburg: Stalling 1932."
"72988";"2";"7";"Ewald";"Banse";"Wehrwissenschaft";"Armanen-Verl.";"Leipzig";"1933";"";"";"";"";"Banse, Ewald: Wehrwissenschaft. Leipzig: Armanen-Verl. 1933."
"72989";"2";"0";"Ewald";"Banse  u. Werner Jansen";"Tausend und eine Nacht";"Rikola-Verl.";"München";"1922";"";"";"";" u. Werner Jansen";"Banse, Ewald, u. Werner Jansen: Tausend und eine Nacht. München: Rikola-Verl. 1922."
"72990";"2";"7";"Jules A.";"Barbey d'Aurevilly";"Die Besessenen";"";"";"";"";"";"";"Sämtl. Ausgaben";"Barbey d'Aurevilly, Jules A.: Die Besessenen. Sämtl. Ausgaben."
"72991";"2";"7";"Henri";"Barbusse";"Sämtliche Schriften";"";"";"";"";"";"";"";"Barbusse, Henri: Sämtliche Schriften."
"72992";"2";"7";"Julio R.";"Barcos";"Freie Frauen";"Antäus-Verl.";"Hamburg";"1931";"";"";"";"";"Barcos, Julio R.: Freie Frauen. Hamburg: Antäus-Verl. 1931."
"72993";"2";"7";"Margarete";"Baré";"Liebe muss zärtlich sein";"Zeitbild-Verl.";"Wien";"1937";"";"";"";"";"Baré, Margarete: Liebe muss zärtlich sein. Wien: Zeitbild-Verl. 1937."
"72994";"2";"7";"Alfred";"Baresel";"Das Beinbuch. Ein Wademecum";"Krick";"Leipzig";"1927";"";"";"";"";"Baresel, Alfred: Das Beinbuch. Ein Wademecum. Leipzig: Krick 1927."
"72995";"2";"0";"Ernst";"Barlach";"Zeichnungen";"Piper";"München";"1935";"";"";"";"";"Barlach, Ernst: Zeichnungen; München: Piper 1935."
"72996";"2";"7";"Carman";"Barnes";"Ich bin ja schon fünfzehn";"Amonesta-Verl.";"Wien";"1931";"";"";"";"";"Barnes, Carman: Ich bin ja schon fünfzehn. Wien: Amonesta-Verl. 1931."
"72997";"2";"7";"Salo";"Baron";"Die politische Theorie Ferdinand Lassalles";"Hirschfeld";"Leipzig";"1923";"";"";"";"";"Baron, Salo: Die politische Theorie Ferdinand Lassalles. Leipzig: Hirschfeld 1923."
"72998";"1";"7";"Philippe";"Barrès";"Sous la vague hitlérienne";"Plon";"Paris";"1933";"";"";"";"";"Barrès, Philippe: Sous la vague hitlérienne. Paris: Plon 1933."
"72999";"2";"7";"Marcel";"Barrière";"Die Kunst zu verführen";"Sturm";"Dresden";"1905";"";"";"";"";"Barrière, Marcel: Die Kunst zu verführen. Dresden: Sturm 1905."
"73000";"2";"7";"Jakub";"Bart-Cišinski";"Narodowc a wotrodźenc. [Patriot und Renegat]";"Koło serbskich spisowaćelow";"Bautzen";"1937";"";"";"";"";"Bart-Cišinski, Jakub: Narodowc a wotrodźenc. [Patriot und Renegat.] Bautzen: Koło serbskich spisowaćelow 1937."
"73001";"2";"7";"Jakub";"Bart-Cišinski";"Za ćichim [In der Stille]";"E. Muka";"Bautzen";"1906";"";"";"";"";"Bart-Cišinski, Jakub: Za ćichim [In der Stille]. Bautzen: E. Muka 1906."
"73002";"2";"7";"Jakub";"Bart-Cišinsky";"Kreẃ a kraj [Blut und Boden]";"Basnik";"Bautzen";"1900";"";"";"";"";"Bart-Cišinsky, Jakub: Kreẃ a kraj [Blut und Boden]. Bautzen: Basnik 1900."
"73003";"2";"7";"Jakub";"Bart-Cišinsky";"Wysk a stysk (Freud und Leid)";"E. Muka";"Bautzen";"1905";"";"";"";"";"Bart-Cišinsky, Jakub: Wysk a stysk (Freud und Leid). Bautzen: E. Muka 1905."
"73004";"2";"7";"Emil";"Barth";"Aus der Werkstatt der deutschen Revolution";"A. Hoffmann";"Berlin";"1920";"";"";"";"";"Barth, Emil: Aus der Werkstatt der deutschen Revolution. Berlin: A. Hoffmann 1920."
"73005";"2";"7";"Erwin";"Barth";"Marxismus und Bolschewismus";"Der Firn";"Berlin";"1919";"";"";"";"";"Barth, Erwin: Marxismus und Bolschewismus. Berlin: Der Firn 1919."
"73006";"2";"7";"Karl";"Barth";"Sämtliche Schriften";"";"";"";"";"";"";"";"Barth, Karl: Sämtliche Schriften."
"73007";"2";"7";"Max";"Barthel";"Blockhaus an der Wolga";"Der Freidenker";"Berlin";"1929";"";"";"";"";"Barthel, Max: Blockhaus an der Wolga. Berlin: Der Freidenker 1929."
"73008";"2";"7";"Max";"Barthel";"Botschaft und Befehl";"Buchmeister-Verl.";"Berlin";"1926";"";"";"";"";"Barthel, Max: Botschaft und Befehl. Berlin: Buchmeister-Verl. 1926."
"73009";"2";"7";"Max";"Barthel";"Deutschland. Lichtbilder u. Schattenrisse einer Reise";"Büchergilde Gutenberg";"Berlin";"1926";"";"";"";"";"Barthel, Max: Deutschland. Lichtbilder u. Schattenrisse einer Reise. Berlin: Büchergilde Gutenberg 1926."
"73010";"2";"7";"Max";"Barthel";"Erde unter den Füßen";"Büchergilde Gutenberg";"Berlin";"1929";"";"";"";"";"Barthel, Max: Erde unter den Füßen. Berlin: Büchergilde Gutenberg 1929."
"73011";"2";"7";"Max";"Barthel";"Das Herz in erhobener Faust. Balladen aus dem Gefängnis";"Kiepenheuer";"Potsdam";"1920";"";"";"";"";"Barthel, Max: Das Herz in erhobener Faust. Balladen aus dem Gefängnis. Potsdam: Kiepenheuer 1920."
"73012";"2";"7";"Max";"Barthel";"Die Mühle zum Toten Mann";"Arbeiterjugend-Verl.";"Berlin";"1927";"";"";"";"";"Barthel, Max: Die Mühle zum Toten Mann. Berlin: Arbeiterjugend-Verl. 1927."
"73013";"2";"7";"Max";"Barthel";"Das Spiel mit der Puppe";"Büchergilde Gutenberg";"Berlin";"1925";"";"";"";"";"Barthel, Max: Das Spiel mit der Puppe. Berlin: Büchergilde Gutenberg 1925."
"73014";"1";"7";"Vernon";"Bartlett";"Nazi Germany explained";"Gollancz";"London";"1933";"";"";"";"";"Bartlett, Vernon: Nazi Germany explained. London: Gollancz 1933."
"73015";"1";"7";"Vernon";"Bartlett";"This is my life";"Chatto & Windus";"London";"1937";"";"";"";"";"Bartlett, Vernon: This is my life. London: Chatto & Windus 1937."
"73016";"2";"9";"Joachim";"Beckmann";"Das erste Gebot";"»Unter d. Wort«";"Wuppertal-Barmen";"1935";"";"";"";"";"Beckmann, Joachim: Das erste Gebot. Wuppertal-Barmen: »Unter d. Wort« 1935."
"73017";"2";"9";"Berta";"Beer";"Grundlagen der praktischen Handlesekunst";"Bechtel";"Lörrach";"1930";"";"";"";"";"Beer, Berta: Grundlagen der praktischen Handlesekunst. Lörrach: Bechtel 1930."
"73018";"2";"9";"Max";"Beer";"Sämtliche Schriften";"";"";"";"";"";"";"";"Beer, Max: Sämtliche Schriften."
"73019";"2";"9";"Hans Wolfgang";"Behm";"Reigen der Keuschheit";"Laurer";"Egestorf";"1928";"";"";"";"";"Behm, Hans Wolfgang: Reigen der Keuschheit. Egestorf: Laurer 1928."
"73020";"2";"9";"Alice";"Behrend";"Sämtliche Schriften";"";"";"";"";"";"";"";"Behrend, Alice: Sämtliche Schriften."
"73021";"2";"9";"Hans";"Beimler";"Sämtliche Schriften";"";"";"";"";"";"";"";"Beimler, Hans: Sämtliche Schriften."
"73022";"2";"9";"Konrad";"Beisswanger";"Sämtliche Schriften";"";"";"";"";"";"";"";"Beisswanger, Konrad: Sämtliche Schriften."
"73023";"2";"9";"";"";"Beitraege zur Vorgeschichte u. Geschichte der Julirevolte";"Heimatdienst";"Wien";"1934";"";"";"";"";"Beitraege zur Vorgeschichte u. Geschichte der Julirevolte. Wien: Heimatdienst 1934."
"73024";"2";"9";"";"";"Bekenntnisse eines flagellantischen Erziehers";"Ferling";"Leipzig";"1921";"";"";"";"";"Bekenntnisse eines flagellantischen Erziehers. Leipzig: Ferling 1921."
"73025";"2";"9";"";"";"Bekenntnissynode der Evangelischen Kirche der Altpreussischen Union. 2. In Dahlem am 4. u. 5. März 1935";"»Unter d. Wort«";"Wuppertal-Barmen";"1935";"";"";"";"";"Bekenntnissynode der Evangelischen Kirche der Altpreussischen Union. 2. In Dahlem am 4. u. 5. März 1935. Wuppertal-Barmen: »Unter d. Wort« 1935."
"73026";"2";"9";"Joseph";"Belli";"Die rote Feldpost unterm Sozialistengesetz";"Dietz";"Berlin";"1926";"";"";"";"";"Belli, Joseph: Die rote Feldpost unterm Sozialistengesetz. Berlin: Dietz 1926."
"73027";"2";"9";"Hilaire";"Belloc";"Die Juden";"Kösel & Pustet";"München";"1927";"";"";"";"";"Belloc, Hilaire: Die Juden. München: Kösel & Pustet 1927."
"73028";"2";"9";"Emil";"Beizner";"Iwan der Pelzhändler";"Rütten & Loening";"Frankfurt";"1929";"";"";"";"";"Beizner, Emil: Iwan der Pelzhändler. Frankfurt: Rütten & Loening 1929."
"73029";"2";"9";"Ernst";"Benedikt";"Karl Josef, Fürst von Ligne";"Gerold";"Wien";"1936";"";"";"";"";"Benedikt, Ernst: Karl Josef, Fürst von Ligne. Wien: Gerold 1936."
"73030";"2";"9";"";"Ben-Esther (Pseud.)";"Menschlichkeiten — Unmenschlichkeiten. Emigrantenschicksale";"Verl. »Die Brücke«";"Prag";"1937";"";"";"";"";"Ben-Esther (Pseud.): Menschlichkeiten — Unmenschlichkeiten. <Emigrantenschicksale.> Prag: Verl. »Die Brücke« 1937."
"73031";"2";"9";"";"";"Benesch, Dr. Eduard ~ im Bild. Die Geschichte eines grossen Lebens";"Orbis-Verl.";"Prag";"1936";"";"";"";"";"Benesch, Dr. Eduard ~ im Bild. Die Geschichte eines grossen Lebens. Prag: Orbis-Verl. 1936."
"73032";"2";"9";"";"Benjamin";"Pfingstnacht";"Wegwalt-Werkstatt";"Wilhelmshagen";"1914";"";"";"";"";"Benjamin: Pfingstnacht. Wilhelmshagen: Wegwalt-Werkstatt 1914."
"73033";"2";"9";"";"";"Benjamin: Tod den Schwachen";"Internat. Arbeiterhilfe";"Berlin";"1925";"";"";"";"";"Benjamin: Tod den Schwachen? Berlin: Internat. Arbeiterhilfe 1925."
"73034";"1";"9";"Mark";"Benney";"Schlechte Gesellschaft";"A. Müller";"Zürich";"1938";"";"";"";"";"Benney, Mark: Schlechte Gesellschaft. Zürich: A. Müller 1938."
"73035";"2";"9";"Richard";"Benz";"Geist u. Reich";"Diederichs";"Jena";"1933";"";"";"";"";"Benz, Richard: Geist u. Reich. Jena: Diederichs 1933."
"73036";"2";"9";"";"Beowulf, Arnim (Pseud.)";"Aus der Liebe geheimnisvollem Lande";"Spohr";"Leipzig";"1906";"";"";"";"";"Beowulf, Arnim (Pseud.): Aus der Liebe geheimnisvollem Lande. Leipzig: Spohr 1906."
"73037";"2";"9";"Martin";"Beradt";"Erdarbeiter";"S. Fischer";"Berlin";"1919";"";"";"";"";"Beradt, Martin: Erdarbeiter. Berlin: S. Fischer 1919."
"73038";"2";"9";"Martin";"Beradt";"Schipper an der Front";"S. Fischer";"Berlin";"1929";"";"";"";"";"Beradt, Martin: Schipper an der Front. Berlin: S. Fischer 1929."
"73039";"2";"9";"Rahel";"Berdach";"Der Kaiser, die Weisen und der Tod";"Saturn-Verl.";"Wien";"1937";"";"";"";"";"Berdach, Rahel: Der Kaiser, die Weisen und der Tod. Wien: Saturn-Verl. 1937."
"73040";"1";"9";"Nikolai";"Berdiajew";"Sämtliche Schriften";"";"";"";"";"";"";"";"Berdiajew, Nikolai: Sämtliche Schriften."
"73041";"2";"9";"Walter Artur";"Berendsohn";"Sämtliche Schriften";"";"";"";"";"";"";"";"Berendsohn, Walter Artur: Sämtliche Schriften."
"73042";"2";"9";"";"Beresowski";"Das Golgatha des weissrussischen Volkes unter der Ferse der polnischen Okkupanten";"Mopr-Verl.";"Berlin";"1928";"";"";"";"";"Beresowski: Das Golgatha des weissrussischen Volkes unter der Ferse der polnischen Okkupanten. Berlin: Mopr-Verl. 1928."
"73043";"2";"9";"Feoktist A.";"Beresowskij";"Die Mutter";"Internat. Arbeiter-Verl.";"Berlin";"1931";"";"";"";"";"Beresowskij, Feoktist A.: Die Mutter. Berlin: Internat. Arbeiter-Verl. 1931."
"73044";"2";"9";"Friedrich";"Berg";"Die weiße Pest";"Münster-Verl.";"Wien";"1926";"";"";"";"";"Berg, Friedrich: Die weiße Pest. Wien: Münster-Verl. 1926."
"73045";"2";"11";"Eduard";"Bernstein";"Sämtliche Schriften";"";"";"";"";"";"";"";"Bernstein, Eduard: Sämtliche Schriften."
"73046";"2";"11";"F.";"Bernstein";"Der Antisemitismus als Gruppenerscheinung";"Jüdischer Verl.";"Berlin";"1926";"";"";"";"";"Bernstein, F.: Der Antisemitismus als Gruppenerscheinung. Berlin: Jüdischer Verl. 1926."
"73047";"1";"11";"Johann Heinrich";"Bernstorff";"Erinnerungen und Briefe";"Polygraph. Verl.";"Zürich";"1936";"";"";"";"";"Bernstorff, Johann Heinrich: Erinnerungen und Briefe. Zürich: Polygraph. Verl. 1936."
"73048";"1";"11";"Sergej K.";"Besborodow";"Die Entdeckung Sibiriens";"Verlagsgen. ausländ. Arbeiter";"Moskau";"1933";"";"";"";"";"Besborodow, Sergej K.: Die Entdeckung Sibiriens. Moskau: Verlagsgen. ausländ. Arbeiter 1933."
"73049";"1";"11";"Sergej K.";"Besborodow";"Johann Liebhardt und Thomas Monger";"Verlagsgen. ausländ. Arbeiter";"Moskau";"1932";"";"";"";"";"Besborodow, Sergej K.: Johann Liebhardt und Thomas Monger. Moskau: Verlagsgen. ausländ. Arbeiter 1932."
"73050";"2";"11";"Grigory";"Bessedowsky";"Im Dienste der Sowjets";"Grethlein";"Leipzig";"1930";"";"";"";"";"Bessedowsky, Grigory: Im Dienste der Sowjets. Leipzig: Grethlein 1930."
"73051";"2";"11";"";"";"Bestehen, Zum 50jährigen ~ des Ordens Bne Briss in Deutschland";"Kauffmann";"Frankfurt";"1933";"";"";"";"";"Bestehen, Zum 50jährigen ~ des Ordens Bne Briss in Deutschland. Frankfurt: Kauffmann 1933."
"73052";"1";"11";"";"";"Bestimmungen über die Wahlen zum Obersten Sowjet der UdSSR";"Verlagsgen. ausländ. Arbeiter";"Moskau";"1937";"";"";"";"";"Bestimmungen über die Wahlen zum Obersten Sowjet der UdSSR. Moskau: Verlagsgen. ausländ. Arbeiter 1937."
"73053";"2";"11";"Ernst Heinrich";"Bethge";"Die Verfassungsfeier";"Danner";"Mühlhausen";"1929";"";"";"";"";"Bethge, Ernst Heinrich: Die Verfassungsfeier. Mühlhausen: Danner 1929."
"73054";"2";"11";"Fritz Ernst";"Bettauer";"Sämtliche Schriften";"";"";"";"";"";"";"";"Bettauer, Fritz Ernst: Sämtliche Schriften."
"73055";"2";"11";"Hugo";"Bettauer";"Sämtliche Schriften";"";"";"";"";"";"";"";"Bettauer, Hugo: Sämtliche Schriften."
"73056";"2";"11";"Alfred";"Beyer";"Menschenökonomie";"Dietz";"Berlin";"1922";"";"";"";"";"Beyer, Alfred: Menschenökonomie. Berlin: Dietz 1922."
"73057";"2";"11";"Friedrich";"Beyer";"Sergeant Albrecht, Unteroffizier Schmelz, Else u. andere Menschen";"Sporn";"Zeulenroda";"1931";"";"";"";"";"Beyer, Friedrich: Sergeant Albrecht, Unteroffizier Schmelz, Else u. andere Menschen. Zeulenroda: Sporn 1931."
"73058";"2";"11";"Georg";"Beyer";"Katholizismus u. Sozialismus";"Dietz";"Berlin";"1927";"";"";"";"";"Beyer, Georg: Katholizismus u. Sozialismus. Berlin: Dietz 1927."
"73059";"2";"11";"Helene";"Beyer";"Führt Geldreform aus Kapitalismus und Krise?";"Verl. »Öffentl. Leben«";"Berlin";"1932";"";"";"";"";"Beyer, Helene: Führt Geldreform aus Kapitalismus und Krise? Berlin: Verl. »Öffentl. Leben« 1932."
"73060";"1";"11";"Fritz";"Beyes";"Schutzbündler-Kinder in der Sowjetunion";"Mopr-Verl.";"Zürich";"1935";"";"";"";"";"Beyes, Fritz: Schutzbündler-Kinder in der Sowjetunion. Zürich: Mopr-Verl. 1935."
"73061";"2";"11";"Max";"Biber";"Auf! Marsch, Marsch! Kleine Kampfschule für die kath. Jugend";"Butzon & Bercker";"Kevelaer";"1934";"";"";"";"";"Biber, Max: Auf! Marsch, Marsch! Kleine Kampfschule für die kath. Jugend. Kevelaer: Butzon & Bercker 1934."
"73062";"2";"11";"Max";"Biber";"Wie Hans und Gretel Kreuzritter wurden";"Druck- u. Verl.-Anst.";"Saarbrücken";"1936";"";"";"";"";"Biber, Max: Wie Hans und Gretel Kreuzritter wurden. Saarbrücken: Druck- u. Verl.-Anst. 1936."
"73063";"2";"11";"Demian";"Bjedny";"Sämtliche Schriften";"";"";"";"";"";"";"";"Bjedny, Demian: Sämtliche Schriften."
"73064";"1";"11";"Hans";"Biefang";"Ruhrkumpels in Sowjetschächten";"Verlagsgen. ausländ. Arbeiter";"Moskau";"1932";"";"";"";"";"Biefang, Hans: Ruhrkumpels in Sowjetschächten. Moskau: Verlagsgen. ausländ. Arbeiter 1932."
"73065";"2";"11";"Käte";"Biel";"Alle Wege führen zu Franz";"Tal";"Leipzig";"1932";"";"";"";"";"Biel, Käte: Alle Wege führen zu Franz. Leipzig: Tal 1932."
"73066";"2";"0";"G.";"Bjelych u. L. Pantelejew";"Schkid, die Republik der Strolche";"Verl. d. Jugendinternationale";"Berlin";"1929";"";"";"";"";"Bjelych, G., u. L. Pantelejew: Schkid, die Republik der Strolche. Berlin: Verl. d. Jugendinternationale 1929."
"73067";"2";"11";"Gregor";"Bienstock";"Sämtliche Schriften";"";"";"";"";"";"";"";"Bienstock, Gregor: Sämtliche Schriften."
"73068";"2";"11";"Otto Julius";"Bierbaum";"Die Haare der heiligen Fringilla u. andere Geschichten";"Langen";"München";"1914";"";"";"";"";"Bierbaum, Otto Julius: Die Haare der heiligen Fringilla u. andere Geschichten. München: Langen 1914."
"73069";"2";"11";"Otto Julius";"Bierbaum";"Prinz Kuckuck";"Georg Müller";"München";"1922";"";"";"";"";"Bierbaum, Otto Julius: Prinz Kuckuck. München: Georg Müller 1922."
"73070";"2";"0";"W. Bruno";"Bierbaum";"Was Sie wissen müssen über Selbstheilung ...";"Ursula-Berl.";"Hirschberg";"1934";"";"";"";"";"Bierbaum, W. Bruno: Was Sie wissen müssen über Selbstheilung ... Hirschberg: Ursula-Verl. 1934."
"73071";"2";"13";"Anna";"Blos";"Sämtliche Schriften";"";"";"";"";"";"";"";"Blos, Anna: Sämtliche Schriften."
"73072";"2";"13";"Wilhelm";"Blos";"Sämtliche Schriften";"";"";"";"";"";"";"";"Blos, Wilhelm: Sämtliche Schriften."
"73073";"2";"13";"Léon";"Bloy";"Das Blut der Armen";"Pustet";"Salzburg";"1936";"";"";"";"";"Bloy, Léon: Das Blut der Armen. Salzburg: Pustet 1936."
"73074";"2";"13";"Hans";"Blueher";"Die Rolle der Erotik in der männlichen Gesellschaft";"Diederichs";"Jena";"1924";"";"";"";"";"Blueher, Hans: Die Rolle der Erotik in der männlichen Gesellschaft. Jena: Diederichs 1924."
"73075";"2";"13";"Hans";"Blueher";"Die deutsche Wandervogelbewegung als erotisches Phänomen";"Weise";"Berlin";"1914";"Kampmann & Schnabel";"Prien";"1922";"";"Blueher, Hans: Die deutsche Wandervogelbewegung als erotisches Phänomen. Berlin: Weise 1914. — Prien: Kampmann & Schnabel 1922."
"73076";"2";"13";"Ludwig";"Bluemcke";"Ein tapferer Hitlerbub";"Anker-Verl.";"Bremen";"1937";"";"";"";"";"Bluemcke, Ludwig: Ein tapferer Hitlerbub. Bremen: Anker-Verl. 1937."
"73077";"2";"13";"";"";"Blueten des Humors. Meine Witze";"Schlothauer";"Leipzig";"1933";"";"";"";"";"Blueten des Humors. Meine Witze. Leipzig: Schlothauer 1933."
"73078";"2";"13";"Edmund";"Blum";"Sämtliche Schriften";"";"";"";"";"";"";"";"Blum, Edmund: Sämtliche Schriften."
"73079";"2";"13";"Léon";"Blum";"Ohne Abrüstung kein Friede";"Dietz";"Berlin";"1931";"";"";"";"";"Blum, Léon: Ohne Abrüstung kein Friede. Berlin: Dietz 1931."
"73080";"2";"13";"";"";"Blut, Heißes ~. Die Tochter des Farmers";"Ad. Ander";"Dresden";"1933";"";"";"";"";"Blut, Heißes ~. Die Tochter des Farmers. Dresden: Ad. Ander 1933."
"73081";"2";"13";"";"";"Blutarbeit, Die~ der Schwarzhemden";"Mopr-Verl.";"Berlin";"1928";"";"";"";"";"Blutarbeit, Die~ der Schwarzhemden. Berlin: Mopr-Verl. 1928."
"73082";"2";"13";"Elena";"Bobinska";"Sämtliche Schriften";"";"";"";"";"";"";"";"Bobinska, Elena: Sämtliche Schriften."
"73083";"1";"13";"C.";"Bobrowskaja";"Die ersten 20 Jahre";"Verlagsgen. ausländ. Arbeiter";"Moskau";"1934";"";"";"";"";"Bobrowskaja, C.: Die ersten 20 Jahre. Moskau: Verlagsgen. ausländ. Arbeiter 1934."
"73084";"1";"13";"C.";"Bobrowskaja";"Wie sie aussahen";"Verlagsgen. ausländ. Arbeiter";"Moskau";"1932";"";"";"";"";"Bobrowskaja, C.: Wie sie aussahen. Moskau: Verlagsgen. ausländ. Arbeiter 1932."
"73085";"2";"13";"August";"Bock";"Völkisches Denken, Volkswirtschaft";"Selbstverl.";"Berlin";"1935";"";"";"";"";"Bock, August: Völkisches Denken, Volkswirtschaft. Berlin: Selbstverl. 1935."
"73086";"2";"13";"Wilhelm";"Bock";"Im Dienste der Freiheit";"Dietz";"Berlin";"1927";"";"";"";"";"Bock, Wilhelm: Im Dienste der Freiheit. Berlin: Dietz 1927."
"73087";"2";"13";"Peter";"Bockemühl";"Mythus oder Evangelium";"E. Müller";"Wuppertal-Barmen";"1935";"";"";"";"";"Bockemühl, Peter: Mythus oder Evangelium. Wuppertal-Barmen: E. Müller 1935."
"73088";"2";"13";"Fritz";"Bodinus";"Morgendämmerung?";"Mattenklodt";"Bielefeld";"1934";"";"";"";"";"Bodinus, Fritz: Morgendämmerung? Bielefeld: Mattenklodt 1934."
"73089";"2";"13";"Fritz";"Bodinus";"Der Vormarsch Japans";"Huss-Verl.";"Konstanz";"1935";"";"";"";"";"Bodinus, Fritz: Der Vormarsch Japans. Konstanz: Huss-Verl. 1935."
"73090";"2";"13";"";"Boehm, Felix, Otto Fenickel, Wilhelm Reich";"Über den Ödipuskomplex";"Internat. psychoanalyt. Verl.";"Wien";"1931";"";"";"";"";"Boehm, Felix, Otto Fenickel, Wilhelm Reich: Über den Ödipuskomplex. Wien: Internat. psychoanalyt. Verl. 1931."
"73091";"2";"13";"Margarete";"Boehme";"Tagebuch einer Verlorenen";"";"";"";"";"";"";"Sämtl. Ausgaben";"Boehme, Margarete: Tagebuch einer Verlorenen. Sämtl. Ausgaben."
"73092";"2";"13";"Wilhelm";"Boerner";"Antisemitismus, Rassenfrage, Menschlichkeit";"Verl. Ethische Gemeinde";"Wien";"1936";"";"";"";"";"Boerner, Wilhelm: Antisemitismus, Rassenfrage, Menschlichkeit. Wien: Verl. Ethische Gemeinde 1936."
"73093";"2";"13";"Wilhelm";"Boerner";"Erziehung zur Friedensgesinnung";"Ethische Verlagsges.";"Wien";"1918";"";"";"";"";"Boerner, Wilhelm: Erziehung zur Friedensgesinnung. Wien: Ethische Verlagsges. 1918."
"73094";"2";"13";"Wilhelm";"Boerner";"Zur ethischen Lebensgestaltung";"Saturn-Verl.";"Wien";"1938";"";"";"";"";"Boerner, Wilhelm: Zur ethischen Lebensgestaltung. Wien: Saturn-Verl. 1938."
"73095";"2";"13";"Wilhelm";"Boerner";"Werdet Helden!";"Beck";"München";"1916";"";"";"";"";"Boerner, Wilhelm: Werdet Helden! München: Beck 1916."
"73096";"2";"13";"Friedrich Karl";"Boesser";"Dauerheilung der Herzschwäche";"";"";"";"";"";"";"Sämtl. Ausgaben";"Boesser, Friedrich Karl: Dauerheilung der Herzschwäche. Sämtl. Ausgaben."
"73097";"2";"13";"Friedrich Karl";"Boesser";"Die Lösung der Krebsfrage";"Leibniz-VerL";"Hannover";"1926";"";"";"";"";"Boesser, Friedrich Karl: Die Lösung der Krebsfrage. Hannover: Leibniz-VerL 1926."
"73098";"2";"13";"Nikolai";"Bogdanow";"Sämtliche Schriften";"";"";"";"";"";"";"";"Bogdanow, Nikolai: Sämtliche Schriften."
"73099";"2";"15";"Frédéric";"Boutet";"Die Insel der sieben Nächte";"Georg Müller";"München";"1928";"";"";"";"";"Boutet, Frédéric: Die Insel der sieben Nächte. München: Georg Müller 1928."
"73100";"2";"15";"Annie von";"Brabenetz";"Brettlfliegen";"Eigenbrödler-Verl.";"Berlin";"1927";"";"";"";"";"Brabenetz, Annie von: Brettlfliegen. Berlin: Eigenbrödler-Verl. 1927."
"73101";"2";"15";"Helmut von";"Bracken";"Die Prügelstrafe in der Erziehung";"Verl. Am andern Ufer";"Dresden";"1926";"";"";"";"";"Bracken, Helmut von: Die Prügelstrafe in der Erziehung. Dresden: Verl. Am andern Ufer 1926."
"73102";"1";"15";"Robert A.";"Brady";"The spirit and structure of German fascism";"Gollancz";"London";"1937";"";"";"";"";"Brady, Robert A.: The spirit and structure of German fascism. London: Gollancz 1937."
"73103";"2";"0";"Mahatma Arkaja";"Brahma";"s. Arkaja Brahma, Mahatma";"";"";"";"";"";"";"";"Brahma, Mahatma Arkaja s. Arkaja Brahma, Mahatma."
"73104";"2";"15";"Karl";"Brammer";"Attentäter, Spitzel und Justizrat Class";"Verl. f. Sozialwiss.";"Berlin";"1924";"";"";"";"";"Brammer, Karl: Attentäter, Spitzel und Justizrat Class. Berlin: Verl. f. Sozialwiss. 1924."
"73105";"2";"15";"Karl";"Brammer";"Das politische Ergebnis des Rathenau-Prozesses";"Verl. f. Sozialwiss.";"Berlin";"1922";"";"";"";"";"Brammer, Karl: Das politische Ergebnis des Rathenau-Prozesses. Berlin: Verl. f. Sozialwiss. 1922."
