"id";"ssflag";"pagenumberinocrdocument";"authorfirstname";"authorlastname";"title";"firsteditionpublisher";"firsteditionpublicationplace";"firsteditionpublicationyear";"secondeditionpublisher";"secondeditionpublicationplace";"secondeditionpublicationyear";"additionalinfos";"ocrresult"
"74065";"2";"81";"Friedrich Albert";"Lange";"Die Arbeiterfrage";"Vorwärts";"Berlin";"1910";"";"";"";"";"Lange, Friedrich Albert: Die Arbeiterfrage. Berlin: Vorwärts 1910."
"74066";"2";"81";"Paul";"Langenscheidt";"Sämtliche Schriften";"";"";"";"";"";"";"";"Langenscheidt, Paul: Sämtliche Schriften."
"74067";"2";"81";"Georg";"Langer";"Die jüdischen Gebetriemen";"Internat. Psychoanalyt. Verl.";"Wien";"1931";"";"";"";"";"Langer, Georg: Die jüdischen Gebetriemen. Wien: Internat. Psychoanalyt. Verl. 1931."
"74068";"2";"81";"M. D. Georg";"Langer";"Die Erotik der Kabbala";"Flesch";"Prag";"1923";"";"";"";"";"Langer, M. D. Georg: Die Erotik der Kabbala. Prag: Flesch 1923."
"74069";"2";"81";"Wolfgang";"Langhoff";"Sämtliche Schriften";"";"";"";"";"";"";"";"Langhoff, Wolfgang: Sämtliche Schriften."
"74070";"2";"81";"P.";"Langner";"Der Massenstreik im Kampfe des Proletariats";"Internat. Arbeiter-Verl.";"Berlin";"1931";"";"";"";"";"Langner, P.: Der Massenstreik im Kampfe des Proletariats. Berlin: Internat. Arbeiter-Verl. 1931."
"74071";"2";"83";"Lotte";"Lehmann";"Anfang und Aufstieg";"Reichner";"Wien";"1937";"";"";"";"";"Lehmann, Lotte: Anfang und Aufstieg. Wien: Reichner 1937."
"74072";"2";"83";"Otto";"Lehmann";"Jan Kollár [Johann Kollar]";"Schmaler";"Bautzen";"1928";"";"";"";"";"Lehmann, Otto: Jan Kollár [Johann Kollar]. Bautzen: Schmaler 1928."
"74073";"2";"83";"Otto";"Lehmann-Russbueldt";"Sämtliche Schriften";"";"";"";"";"";"";"";"Lehmann-Russbueldt, Otto: Sämtliche Schriften."
"74074";"2";"83";"Friedrich";"Lehner";"Wie werden Brautleute in der Ehe glücklich?";"Schlusche";"Lobnig";"1938";"";"";"";"";"Lehner, Friedrich: Wie werden Brautleute in der Ehe glücklich? Lobnig: Schlusche 1938."
"74075";"2";"83";"Curt Carl Adolf";"Lehning";"Die Rettung der Weltwirtschaft durch die mathem. u. bilanzierende Lösung der Geldfrage";"Hauschild";"Bremen";"1933";"";"";"";"";"Lehning, Curt Carl Adolf: Die Rettung der Weltwirtschaft durch die mathem. u. bilanzierende Lösung der Geldfrage. Bremen: Hauschild 1933."
"74076";"2";"83";"";"";"Lehren, Die ~ der Saarniederlage";"Wehle";"Prag";"1935";"";"";"";"";"Lehren, Die ~ der Saarniederlage. Prag: Wehle 1935."
"74077";"2";"83";"Otto";"Leichter";"Die Sprengung des Kapitalismus";"Wiener Volksbuchh.";"Wien";"1932";"";"";"";"";"Leichter, Otto: Die Sprengung des Kapitalismus. Wien: Wiener Volksbuchh. 1932."
"74078";"2";"83";"Otto";"Leichter";"Die Wirtschaftsrechnung in der sozialistischen Gesellschaft";"Wiener Volksbuchh.";"Wien";"1923";"";"";"";"";"Leichter, Otto: Die Wirtschaftsrechnung in der sozialistischen Gesellschaft. Wien: Wiener Volksbuchh. 1923."
"74079";"1";"83";"Eva";"Leidmann";"Auch meine Mutter freute sich nicht!";"Zinnen-Verl.";"Basel";"1932";"";"";"";"";"Leidmann, Eva: Auch meine Mutter freute sich nicht! Basel: Zinnen-Verl. 1932."
"74080";"1";"83";"Eva";"Leidmann";"Wie man sich bettet";"Zinnen-Verl.";"Basel";"1933";"";"";"";"";"Leidmann, Eva: Wie man sich bettet. Basel: Zinnen-Verl. 1933."
"74081";"2";"83";"Martin";"Leinert";"Die Sozialgeschichte der Grosstadt";"Vera-Verl.";"Hamburg";"1925";"";"";"";"";"Leinert, Martin: Die Sozialgeschichte der Grosstadt. Hamburg: Vera-Verl. 1925."
"74082";"2";"83";"Emmy";"Leitner";"Sämtliche Schriften. Leitner, Marie: Hotel Amerika";"Neuer dt. Verl.";"Berlin";"1930";"";"";"";"";"Leitner, Emmy: Sämtliche Schriften. Leitner, Marie: Hotel Amerika. Berlin: Neuer dt. Verl. 1930."
"74083";"2";"83";"Erwin";"Le Mang";"Heiratsschwindler und ihre Tricks";"Rudolph";"Dresden";"1929";"";"";"";"";"Le Mang, Erwin: Heiratsschwindler und ihre Tricks. Dresden: Rudolph 1929."
"74084";"2";"83";"Alfred";"Lemm";"Der fliehende Felician";"Georg Müller";"München";"1917";"";"";"";"";"Lemm, Alfred: Der fliehende Felician. München: Georg Müller 1917."
"74085";"2";"83";"Alfred";"Lemm";"Mord";"Roland-Verl.";"München";"1918";"";"";"";"";"Lemm, Alfred: Mord. München: Roland-Verl. 1918."
"74086";"2";"83";"Alfred";"Lemm";"Vom Wesen der wahren Vaterlandsliebe";"Barger";"Berlin";"1917";"";"";"";"";"Lemm, Alfred: Vom Wesen der wahren Vaterlandsliebe. Berlin: Barger 1917."
"74087";"2";"83";"Camille";"Lemonnier";"Es geht ein Wind durch die Mühlen";"Der Bücherkreis";"Berlin";"1928";"";"";"";"";"Lemonnier, Camille: Es geht ein Wind durch die Mühlen. Berlin: Der Bücherkreis 1928."
"74088";"2";"83";"Camille";"Lemonnier";"Die Liebe im Menschen";"Wigand";"Leipzig";"1920";"";"";"";"";"Lemonnier, Camille: Die Liebe im Menschen. Leipzig: Wigand 1920."
"74089";"2";"83";"Camille";"Lemonnier";"Der eiserne Moloch";"Juncker";"Berlin";"1924";"Der Bücherkreis";"Berlin";"1928";"";"Lemonnier, Camille: Der eiserne Moloch. Berlin: Juncker 1924. — Berlin: Der Bücherkreis 1928."
"74090";"2";"83";"Emil";"Lengyel";"Sämtliche Schriften";"";"";"";"";"";"";"";"Lengyel, Emil: Sämtliche Schriften."
"74091";"2";"83";"Ludwig";"Lenhart";"Kettelers Zeitrufe";"Bachem";"Köln";"1935";"";"";"";"";"Lenhart, Ludwig: Kettelers Zeitrufe. Köln: Bachem 1935."
"74092";"2";"83";"";"";"Lenin. Leben u. Werk";"Verl. f. Lit. u. Politik";"Wien";"1924";"";"";"";"";"Lenin. Leben u. Werk. Wien: Verl. f. Lit. u. Politik 1924."
"74093";"2";"83";"";"";"Lenin, Mit ~. 50 Kampflieder";"Verl. Junge Garde";"Berlin";"1922";"";"";"";"";"Lenin, Mit ~. 50 Kampflieder. Berlin: Verl. Junge Garde 1922."
"74094";"1";"83";"";"";"Lenin in den ersten Tagen der Sowjetmacht";"Verlagsgen. ausländ. Arbeiter";"Moskau";"1934";"";"";"";"";"Lenin in den ersten Tagen der Sowjetmacht. Moskau: Verlagsgen. ausländ. Arbeiter 1934."
"74095";"2";"83";"Wladimir Iljitsch";"Lenin";"Sämtliche Schriften von und über ~";"";"";"";"";"";"";"";"Lenin, Wladimir Iljitsch: Sämtliche Schriften von und über ~."
"74096";"1";"83";"";"";"Leninismus. Lesehefte f. Schulen u. Selbstunterricht";"Verlagsgen. ausländ. Arbeiter";"Moskau";"1935";"";"";"";"";"Leninismus. Lesehefte f. Schulen u. Selbstunterricht. Moskau: Verlagsgen. ausländ. Arbeiter 1935."
"74097";"2";"83";"";"";"Lenin-Märchen";"Verl. d. Jugendinternationale";"Berlin";"1929";"";"";"";"";"Lenin-Märchen. Berlin: Verl. d. Jugendinternationale 1929."
"74098";"2";"83";"Emil";"Lenk";"Die Ehe in der Praxis";"Asa-Verl.";"Leipzig";"1931";"";"";"";"";"Lenk, Emil: Die Ehe in der Praxis. Leipzig: Asa-Verl. 1931."
"74099";"2";"83";"Eugen";"Lennhoff";"Sämtliche Schriften";"";"";"";"";"";"";"";"Lennhoff, Eugen: Sämtliche Schriften."
"74100";"2";"83";"Paul";"Lensch";"Sämtliche Schriften";"";"";"";"";"";"";"";"Lensch, Paul: Sämtliche Schriften."
"74101";"2";"85";"";"";"Lexikon des geheimen Wissens";"Hutter";"Wien";"1934";"";"";"";"";"Lexikon des geheimen Wissens. Wien: Hutter 1934."
"74102";"2";"85";"Gerhard von";"Leyst";"Kurzgefasster Leitfaden für den russischen Sprachunterricht";"Fesdand-Verl.";"Berlin";"1929";"";"";"";"";"Leyst, Gerhard von: Kurzgefasster Leitfaden für den russischen Sprachunterricht. Berlin: Fesdand-Verl. 1929."
"74103";"2";"85";"Jurij";"Libedinsky";"Sämtliche Schriften";"";"";"";"";"";"";"";"Libedinsky, Jurij: Sämtliche Schriften."
"74104";"2";"85";"Karl Max";"Lichnowsky";"Auf dem Wege zum Abgrund";"Reissner";"Dresden";"1927";"";"";"";"";"Lichnowsky, Karl Max: Auf dem Wege zum Abgrund. Dresden: Reissner 1927."
"74105";"2";"85";"Siegfried";"Lichtenstaedter";"Antisemitica";"Engel";"Leipzig";"1926";"";"";"";"";"Lichtenstaedter, Siegfried: Antisemitica. Leipzig: Engel 1926."
"74106";"2";"85";"Siegfried";"Lichtenstaedter";"Geburtenregelung und Judentum";"Engel";"Leipzig";"1933";"";"";"";"";"Lichtenstaedter, Siegfried: Geburtenregelung und Judentum. Leipzig: Engel 1933."
"74107";"2";"85";"Siegfried";"Lichtenstaedter";"Praktisches Judentum";"Engel";"Leipzig";"1931";"";"";"";"";"Lichtenstaedter, Siegfried: Praktisches Judentum. Leipzig: Engel 1931."
"74108";"2";"85";"Siegfried";"Lichtenstaedter";"Nationalitätsprinzip und Bevölkerungsaustausch";"Verl. d. Schönheit";"Dresden";"1917";"";"";"";"";"Lichtenstaedter, Siegfried: Nationalitätsprinzip und Bevölkerungsaustausch. Dresden: Verl. d. Schönheit 1917."
"74109";"2";"85";"Siegfried";"Lichtenstaedter";"Jüdische Politik";"Engel";"Leipzig";"1933";"";"";"";"";"Lichtenstaedter, Siegfried: Jüdische Politik. Leipzig: Engel 1933."
"74110";"2";"85";"Siegfried";"Lichtenstaedter";"Recht oder Unrecht?";"Verl. d. Schönheit";"Dresden";"1915";"";"";"";"";"Lichtenstaedter, Siegfried: Recht oder Unrecht? Dresden: Verl. d. Schönheit 1915."
"74111";"2";"85";"Siegfried";"Lichtenstaedter";"Die jüdische Religion in Gegenwart u. Zukunft";"Engel";"Leipzig";"1921";"";"";"";"";"Lichtenstaedter, Siegfried: Die jüdische Religion in Gegenwart u. Zukunft. Leipzig: Engel 1921."
"74112";"2";"85";"Siegfried";"Lichtenstaedter";"Schächtfrage und Schächtgegner";"Engel";"Leipzig";"1931";"";"";"";"";"Lichtenstaedter, Siegfried: Schächtfrage und Schächtgegner. Leipzig: Engel 1931."
"74113";"2";"85";"Siegfried";"Lichtenstaedter";"Schächtfrage und jüdische Speisegesetze";"Engel";"Leipzig";"1927";"";"";"";"";"Lichtenstaedter, Siegfried: Schächtfrage und jüdische Speisegesetze. Leipzig: Engel 1927."
"74114";"2";"85";"Siegfried";"Lichtenstaedter";"Schächtfrage und Tierschutz";"Engel";"Leipzig";"1929";"";"";"";"";"Lichtenstaedter, Siegfried: Schächtfrage und Tierschutz. Leipzig: Engel 1929."
"74115";"2";"85";"";"";"Lichtkleid, Im ~";"Verl. Gesundes Leben";"Rudolstadt";"1924";"";"";"";"";"Lichtkleid, Im ~. Rudolstadt: Verl. Gesundes Leben 1924."
"74116";"1";"85";"Lou";"Lichtveld";"De sfinx van Spanje";"Nijgh & Van Ditmar";"Rotterdam";"1937";"";"";"";"";"Lichtveld, Lou: De sfinx van Spanje. Rotterdam: Nijgh & Van Ditmar 1937."
"74117";"1";"85";"Leopold";"Lichtwitz";"Pathologie der Funktionen und Regulationen";"Sijthoff";"Leiden";"1936";"";"";"";"";"Lichtwitz, Leopold: Pathologie der Funktionen und Regulationen. Leiden: Sijthoff 1936."
"74118";"2";"85";"Vladimir";"Lidin";"Der Abtrünnige";"Drei Kegel-Verl.";"Berlin";"1928";"";"";"";"";"Lidin, Vladimir: Der Abtrünnige. Berlin: Drei Kegel-Verl. 1928."
"74119";"2";"85";"Fritz";"Lieb";"Sämtliche Schriften";"";"";"";"";"";"";"";"Lieb, Fritz: Sämtliche Schriften."
"74120";"2";"85";"";"";"Liebe glücklich: lebe glücklich";"Berolina";"Berlin";"1932";"";"";"";"";"Liebe glücklich: lebe glücklich! Berlin: Berolina 1932."
"74121";"2";"85";"";"";"Liebe und Leidenschaft. Flagell.-erot. Roman.";"";"o. O.";"1930";"";"";"";"";"Liebe und Leidenschaft. Flagell.-erot. Roman. o. O. 1930."
"74122";"2";"0";"";"";"Liebe in London: Flagell.-masoch. Roman";"";"";"";"";"";"";"";"Liebe in London: Flagell.-masoch. Roman. o. O. u. J."
"74123";"2";"85";"";"";"Liebe im Orient. Bd 1—3";"Schneider";"Wien";"1929";"";"";"";"";"Liebe im Orient. Bd 1—3. Wien: Schneider 1929."
"74124";"2";"85";"";"";"Liebe verboten";"Verl. f. Arbeiterkultur";"Berlin";"1931";"";"";"";"";"Liebe verboten. Berlin: Verl. f. Arbeiterkultur 1931."
"74125";"2";"85";"";"";"Liebe und Wollust. Erzählungen.";"";"o. O.";"1905";"";"";"";"";"Liebe und Wollust. Erzählungen. o. O. 1905."
"74126";"2";"85";"Matjew";"Liebermann";"Sämtliche Schriften";"";"";"";"";"";"";"";"Liebermann, Matjew: Sämtliche Schriften."
"74127";"2";"85";"";"";"Liebeslehre, Die ~";"Kultur-Verl.";"Berlin";"1928";"";"";"";"";"Liebeslehre, Die ~. Berlin: Kultur-Verl. 1928."
"74128";"2";"85";"";"";"Liebeslexikon von A bis Z";"Verl. f. Kulturforschung";"Wien";"1932";"";"";"";"";"Liebeslexikon von A bis Z. Wien: Verl. f. Kulturforschung 1932."
"74129";"2";"85";"";"";"Liebesorakel, Das untrügliche ~";"Buchversand Gutenberg";"Dresden";"1931";"";"";"";"";"Liebesorakel, Das untrügliche ~. Dresden: Buchversand Gutenberg 1931."
"74130";"2";"85";"";"";"Liebestempel, Der ~";"Elite-Verl.";"Leipzig";"1929";"";"";"";"";"Liebestempel, Der ~. Leipzig: Elite-Verl. 1929."
"74131";"1";"87";"Franz";"Lipp";"Kriegsschuld — Kriegsende";"Ed. Sebastian Brant";"Strassburg";"1934";"";"";"";"";"Lipp, Franz: Kriegsschuld — Kriegsende. Strassburg: Ed. Sebastian Brant 1934."
"74132";"1";"87";"Z.";"Lippay";"Hinter den Kulissen der Abrüstungs-Konferenz";"Verlagsgen. ausländ. Arbeiter";"Moskau";"1932";"";"";"";"";"Lippay, Z.: Hinter den Kulissen der Abrüstungs-Konferenz. Moskau: Verlagsgen. ausländ. Arbeiter 1932."
"74133";"2";"87";"Jakob";"Lippmann";"Lassalles Ende";"Jahn";"Leipzig";"1922";"";"";"";"";"Lippmann, Jakob: Lassalles Ende. Leipzig: Jahn 1922."
"74134";"1";"87";"Eva";"Lips";"Savage symphony. A personal record of the Third Reich";"Random house";"New York";"1938";"";"";"";"";"Lips, Eva: Savage symphony. A personal record of the Third Reich. New York: Random house 1938."
"74135";"1";"87";"Eva";"Lips";"Savage symphony: What Hitler did to us";"H. Joseph";"London";"1938";"";"";"";"";"Lips, Eva: Savage symphony: What Hitler did to us. London: H. Joseph 1938."
"74136";"2";"87";"Hippolyte Prosper Olivier";"Lissagaray";"Sämtliche Schriften";"";"";"";"";"";"";"";"Lissagaray, Hippolyte Prosper Olivier: Sämtliche Schriften."
"74137";"2";"87";"Paul";"Lissmann";"Briefe an sexualpathologische Männer";"Marcus";"Berlin";"1918";"";"";"";"";"Lissmann, Paul: Briefe an sexualpathologische Männer. Berlin: Marcus 1918."
"74138";"1";"87";"A.";"Litwak";"Neue Punkte auf der Landkarte";"Verlagsgen. ausländ. Arbeiter";"Moskau";"1932";"";"";"";"";"Litwak, A.: Neue Punkte auf der Landkarte. Moskau: Verlagsgen. ausländ. Arbeiter 1932."
"74139";"1";"87";"Maxim M.";"Litwinow";"Die Sowjetunion — ein machtvolles Bollwerk des allgemeinen Friedens";"Verlagsgen. ausländ. Arbeiter";"Moskau";"1936";"";"";"";"";"Litwinow, Maxim M.: Die Sowjetunion — ein machtvolles Bollwerk des allgemeinen Friedens. Moskau: Verlagsgen. ausländ. Arbeiter 1936."
"74140";"2";"87";"Fedor";"Liubow";"Golod. Russischer Hunger";"Ehrlich";"Berlin";"1922";"";"";"";"";"Liubow, Fedor: Golod. Russischer Hunger. Berlin: Ehrlich 1922."
"74141";"1";"87";"J. William";"Lloyd";"Die Methode Karezza oder Magnetation";"Veen";"Amersfoort";"1922";"";"";"";"";"Lloyd, J. William: Die Methode Karezza oder Magnetation. Amersfoort: Veen 1922."
"74142";"1";"87";"J. William";"Lloyd";"Karezza-Praxis";"Zitzmann";"Lauf";"1930";"";"";"";"";"Lloyd, J. William: Karezza-Praxis. Lauf: Zitzmann 1930."
"74143";"2";"87";"Josef";"Loebel";"Von der Ehe bis zur Liebe";"Grethlein";"Leipzig";"1929";"";"";"";"";"Loebel, Josef: Von der Ehe bis zur Liebe. Leipzig: Grethlein 1929."
"74144";"2";"87";"Ernst Friedrich";"Loehndorff";"Afrika weint";"Grethlein";"Leipzig";"1930";"Schünemann";"Bremen";"1933";"";"Loehndorff, Ernst Friedrich: Afrika weint. Leipzig: Grethlein 1930. — Bremen: Schünemann 1933."
"74145";"2";"87";"Busso";"Loewe";"Das ABC des Deutschen Heiden";"Thiel & Böhm";"Erfurt";"1935";"";"";"";"";"Loewe, Busso: Das ABC des Deutschen Heiden. Erfurt: Thiel & Böhm 1935."
"74146";"2";"87";"Kurt";"Loewenstein";"Sämtliche Schriften";"";"";"";"";"";"";"";"Loewenstein, Kurt: Sämtliche Schriften."
"74147";"2";"87";"Hubertus Prinz zu";"Loewenstein-Wertheim-Freudenberg";"Sämtliche Schriften";"";"";"";"";"";"";"";"Loewenstein-Wertheim-Freudenberg, Hubertus Prinz zu: Sämtliche Schriften."
"74148";"1";"87";"Karl";"Loewith";"Jacob Burckhardt";"Vita Nova-Verl.";"Luzern";"1936";"";"";"";"";"Loewith, Karl: Jacob Burckhardt. Luzern: Vita Nova-Verl. 1936."
"74149";"2";"87";"Julius";"Loewy";"Das Wunder der Liebe";"Hesse u. Becker";"Leipzig";"1927";"";"";"";"";"Loewy, Julius: Das Wunder der Liebe. Leipzig: Hesse u. Becker 1927."
"74150";"1";"87";"Anatolij";"Loginow";"Die Bauarbeiter im Lande des Sozialismus";"Ed. Prométhée";"Strassburg";"1937";"";"";"";"";"Loginow, Anatolij: Die Bauarbeiter im Lande des Sozialismus. Strassburg: Ed. Prométhée 1937."
"74151";"2";"87";"Johannes";"Lohmann";"Hitlerworte als Gleichnisse für Gottesworte";"Christi. Schriftenvertrieb Maar";"Bamberg";"1934";"";"";"";"";"Lohmann, Johannes: Hitlerworte als Gleichnisse für Gottesworte. Bamberg: Christi. Schriftenvertrieb Maar 1934."
"74152";"2";"87";"Richard";"Lohmann";"Sämtliche Schriften";"";"";"";"";"";"";"";"Lohmann, Richard: Sämtliche Schriften."
"74153";"1";"87";"Alfred";"Loisy";"La Crise morale du temps présent et l'éducation humaine";"Thiébaud";"Paris";"1937";"";"";"";"";"Loisy, Alfred: La Crise morale du temps présent et l'éducation humaine. Paris: Thiébaud 1937."
"74154";"2";"87";"Jurij W.";"Lomonossoff";"Die russische Märzrevolution 1917";"Drei Masken-Verl.";"München";"1921";"";"";"";"";"Lomonossoff, Jurij W.: Die russische Märzrevolution 1917. München: Drei Masken-Verl. 1921."
"74155";"2";"87";"Jack";"London";"Martin Eden";"";"";"";"";"";"";"Sämtl. Ausgaben";"London, Jack: Martin Eden. Sämtl. Ausgaben."
"74156";"2";"87";"Jack";"London";"Die eiserne Ferse";"";"";"";"";"";"";"Sämtl. Ausgaben";"London, Jack: Die eiserne Ferse. Sämtl. Ausgaben."
"74157";"2";"87";"Jack";"London";"Die Zwangsjacke";"Universitas";"Berlin";"1930";"";"";"";"";"London, Jack: Die Zwangsjacke. Berlin: Universitas 1930."
"74158";"2";"87";"Albert";"Londres";"Bagno";"Laub";"Berlin";"1924";"";"";"";"";"Londres, Albert: Bagno. Berlin: Laub 1924."
"74159";"2";"89";"Mathilde";"Ludendorff";"Verschüttete Volksseele";"Ludendorff-Verl.";"München";"1935";"";"";"";"";"Ludendorff, Mathilde: Verschüttete Volksseele. München: Ludendorff-Verl. 1935."
"74160";"2";"89";"Emil";"Ludwig";"Sämtliche Schriften";"";"";"";"";"";"";"";"Ludwig, Emil: Sämtliche Schriften."
"74161";"2";"89";"Ernst";"Luedemann";"Die Nerven";"Arbeitsgemeinschaft f. Kultur u. Aufbau";"München";"1928";"Stalling";"Oldenburg";"1930";"";"Luedemann, Ernst: Die Nerven. München: Arbeitsgemeinschaft f. Kultur u. Aufbau 1928. — Oldenburg: Stalling 1930."
"74162";"2";"89";"Walter";"Luetgebrune";"Ein Kampf um Röhm";"Huber";"Diessen";"1933";"";"";"";"";"Luetgebrune, Walter: Ein Kampf um Röhm. Diessen: Huber 1933."
"74163";"1";"89";"Walter";"Luethi";"Die kommende Kirche";"Reinhardt";"Basel";"1937";"";"";"";"";"Luethi, Walter: Die kommende Kirche. Basel: Reinhardt 1937."
"74164";"1";"89";"";"";"Luethi, Walter, u. Robert Brunner: Schweigt die Kirche";"Gotthelf-Verl.";"Bern";"1936";"";"";"";"";"Luethi, Walter, u. Robert Brunner: Schweigt die Kirche? Bern: Gotthelf-Verl. 1936."
"74165";"1";"0";"Wilhelm";"Luftig";"Fort mit Brille und Augenglas!";"Verl. für Augenheilkunde ";"Berlin";"1931";"";"";"";"";"Luftig, Wilhelm: Fort mit Brille und Augenglas! Berlin: Verl. für Augenheilkunde ... 1931."
"74166";"1";"0";"Wilhelm";"Luftig";"Netzhautablösung und ihre operationslose Behandlung";"Verl. für Augenheilkunde ...";"Berlin";"1931";"";"";"";"";"Luftig, Wilhelm: Netzhautablösung und ihre operationslose Behandlung. Berlin: Verl. für Augenheilkunde ... 1931."
"74167";"2";"89";"Georg";"Lukacs";"Moses Hess und die Probleme der idealistischen Dialektik";"Hirschfeld";"Leipzig";"1926";"";"";"";"";"Lukacs, Georg: Moses Hess und die Probleme der idealistischen Dialektik. Leipzig: Hirschfeld 1926."
"74168";"1";"89";"Michael";"Lukjanow";"Iwanowo-Wosnessensk das rote Textilgebiet";"Verlagsgen. ausländ. Arbeiter";"Moskau";"1932";"";"";"";"";"Lukjanow, Michael: Iwanowo-Wosnessensk das rote Textilgebiet. Moskau: Verlagsgen. ausländ. Arbeiter 1932."
"74169";"2";"89";"Anatolij";"Lunatscharskij";"Sämtliche Schriften";"";"";"";"";"";"";"";"Lunatscharskij, Anatolij: Sämtliche Schriften."
"74170";"1";"89";"Heinz";"Lunau";"Die geistige Situation der Deutschen";"Ed. de la Phalange";"Brüssel";"1936";"";"";"";"";"Lunau, Heinz: Die geistige Situation der Deutschen. Brüssel: Ed. de la Phalange 1936."
"74171";"1";"89";"Ferdinand";"Lundberg";"Amerikas 60 Familien";"A. de Lange";"Amsterdam";"1938";"";"";"";"";"Lundberg, Ferdinand: Amerikas 60 Familien. Amsterdam: A. de Lange 1938."
"74172";"2";"89";"Hans";"Lungwitz";"Lamias Leidenschaft";"Lissner";"Berlin";"1920";"";"";"";"";"Lungwitz, Hans: Lamias Leidenschaft. Berlin: Lissner 1920."
"74173";"2";"89";"Hans";"Lungwitz";"Über Psychoanalyse";"Oldenburg";"Leipzig";"1924";"";"";"";"";"Lungwitz, Hans: Über Psychoanalyse. Leipzig: Oldenburg 1924."
"74174";"2";"89";"David";"Luschnat";"Sämtliche Schriften";"";"";"";"";"";"";"";"Luschnat, David: Sämtliche Schriften."
"74175";"2";"89";"Walter";"Lustig";"Gesetzes- und Rechtskunde für Kranken-, Säuglings- und Fürsorgeschwestern";"Formular-Verl.";"Berlin";"1937";"";"";"";"";"Lustig, Walter: Gesetzes- und Rechtskunde für Kranken-, Säuglings- und Fürsorgeschwestern. Berlin: Formular-Verl. 1937."
"74176";"2";"89";"Walter";"Lustig";"Die theoretischen Grundlagen der praktischen Krankenpflege";"Fischers mediz. Buchh.";"Leipzig";"1933";"";"";"";"";"Lustig, Walter: Die theoretischen Grundlagen der praktischen Krankenpflege. Leipzig: Fischers mediz. Buchh. 1933."
"74177";"2";"89";"Heinrich";"Lux";"Etienne Cabet u. der ikarische Kommunismus";"Dietz";"Stuttgart";"1894";"";"";"";"";"Lux, Heinrich: Etienne Cabet u. der ikarische Kommunismus. Stuttgart: Dietz 1894."
"74178";"2";"89";"Heinrich";"Lux";"Sozialpolitisches Handbuch";"Vorwärts";"Berlin";"1892";"";"";"";"";"Lux, Heinrich: Sozialpolitisches Handbuch. Berlin: Vorwärts 1892."
"74179";"2";"89";"Heinrich";"Lux";"Die Prostitution";"Vorwärts";"Berlin";"1893";"";"";"";"";"Lux, Heinrich: Die Prostitution. Berlin: Vorwärts 1893."
"74180";"2";"89";"Heinrich";"Lux";"Die technische Revolution und der Kapitalismus";"Baake";"Berlin";"1895";"";"";"";"";"Lux, Heinrich: Die technische Revolution und der Kapitalismus. Berlin: Baake 1895."
"74181";"2";"89";"Joseph August";"Lux";"Das goldene Buch der vaterländischen Geschichte für Volk u. Jugend Oesterreichs";"Gerlach & Wiedling";"Wien";"1934";"";"";"";"";"Lux, Joseph August: Das goldene Buch der vaterländischen Geschichte für Volk u. Jugend Oesterreichs. Wien: Gerlach & Wiedling 1934."
"74182";"2";"89";"Rosa";"Luxemburg";"Sämtliche Schriften von und über ~";"";"";"";"";"";"";"";"Luxemburg, Rosa: Sämtliche Schriften von und über ~."
"74183";"2";"89";"Eugène";"Lyons";"Sacco und Vanzetti";"Neuer dt. Verl.";"Berlin";"1928";"";"";"";"";"Lyons, Eugène: Sacco und Vanzetti. Berlin: Neuer dt. Verl. 1928."
"74184";"2";"89";"Joachim";"Maass";"Bohème ohne Mimi";"S. Fischer";"Berlin";"1930";"";"";"";"";"Maass, Joachim: Bohème ohne Mimi. Berlin: S. Fischer 1930."
"74185";"2";"89";"Alfred";"Mac Cann";"Kultursiechtum und Säuretod";"Pahl";"Dresden";"1927";"";"";"";"";"Mac Cann, Alfred: Kultursiechtum und Säuretod. Dresden: Pahl 1927."
"74186";"2";"89";"Alfred";"Machard";"Titine";"Georg Müller";"München";"1923";"";"";"";"";"Machard, Alfred: Titine. München: Georg Müller 1923."
"74187";"2";"91";"Heinrich";"Mann";"Sämtliche Schriften";"";"";"";"";"";"";"";"Mann, Heinrich: Sämtliche Schriften."
"74188";"2";"91";"Klaus";"Mann";"Sämtliche Schriften";"";"";"";"";"";"";"";"Mann, Klaus: Sämtliche Schriften."
"74189";"2";"91";"Thomas";"Mann";"Sämtliche Schriften";"";"";"";"";"";"";"";"Mann, Thomas: Sämtliche Schriften."
"74190";"2";"91";"Wilhelm";"Mann";"Schulstaat und Selbstregierung der Schüler";"Beyer";"Langensalza";"1914";"";"";"";"";"Mann, Wilhelm: Schulstaat und Selbstregierung der Schüler. Langensalza: Beyer 1914."
"74191";"1";"91";"Karl";"Mannheim";"Mensch und Gesellschaft im Zeitalter des Umbaus";"Sijthoff";"Leiden";"1935";"";"";"";"";"Mannheim, Karl: Mensch und Gesellschaft im Zeitalter des Umbaus. Leiden: Sijthoff 1935."
"74192";"2";"91";"Georg";"Mannheimer";"Lieder eines Juden";"Neumann & Co.";"Prag";"1937";"";"";"";"";"Mannheimer, Georg: Lieder eines Juden. Prag: Neumann & Co. 1937."
"74193";"2";"91";"";"";"Manolescu. Der Fürst der Diebe. Bd 1—5";"Dietsch- u. Speka-Verl.";"Leipzig";"1928/30";"";"";"";"";"Manolescu. Der Fürst der Diebe. Bd 1—5. Leipzig: Dietsch- u. Speka-Verl. 1928/30."
"74194";"2";"91";"Paul";"Mantegazza";"Die Geschlechtsverhältnisse des Menschen";"Schillerbuchh.";"Berlin";"1925";"";"";"";"";"Mantegazza, Paul: Die Geschlechtsverhältnisse des Menschen. Berlin: Schillerbuchh. 1925."
"74195";"2";"91";"Paul";"Mantegazza";"Die Hygiene der Liebe";"";"";"";"";"";"";"Sämtliche Ausgaben";"Mantegazza, Paul: Die Hygiene der Liebe. Sämtliche Ausgaben."
"74196";"1";"91";"Dimitri S.";"Manuilski";"Das Ende der kapitalistischen Stabilisierung";"Verlagsgen. ausländ. Arbeiter";"Moskau";"1932";"";"";"";"";"Manuilski, Dimitri S.: Das Ende der kapitalistischen Stabilisierung. Moskau: Verlagsgen. ausländ. Arbeiter 1932."
"74197";"1";"91";"Dimitri S.";"Manuilski";"Engels im Kampf für den revolutionären Marxismus";"Verlagsgen. ausländ. Arbeiter";"Moskau";"1935";"Ed. Prométhée";"Strassburg";"1935";"";"Manuilski, Dimitri S.: Engels im Kampf für den revolutionären Marxismus. Moskau: Verlagsgen. ausländ. Arbeiter 1935. — Strassburg: Ed. Prométhée 1935."
"74198";"1";"91";"Dimitri S.";"Manuilski";"Die Ergebnisse des 7. Weltkongresses der kommun. Internationale";"Verlagsgen. ausländ. Arbeiter";"Moskau";"1935";"";"";"";"";"Manuilski, Dimitri S.: Die Ergebnisse des 7. Weltkongresses der kommun. Internationale. Moskau: Verlagsgen. ausländ. Arbeiter 1935."
"74199";"1";"91";"Dimitri S.";"Manuilski";"Die revolutionäre Krise reift heran";"Verlagsgen. ausländ. Arbeiter";"Moskau";"1934";"";"";"";"";"Manuilski, Dimitri S.: Die revolutionäre Krise reift heran. Moskau: Verlagsgen. ausländ. Arbeiter 1934."
"74200";"1";"91";"Dimitri S.";"Manuilski";"Der Sieg des Sozialismus in der Sowjetunion und seine weltgeschichtliche Bedeutung";"Verlagsgen. ausländ. Arbeiter";"Moskau";"1935";"";"";"";"";"Manuilski, Dimitri S.: Der Sieg des Sozialismus in der Sowjetunion und seine weltgeschichtliche Bedeutung. Moskau: Verlagsgen. ausländ. Arbeiter 1935."
